"Authors","Author full names","Author(s) ID","Title","Year","Source title","Volume","Issue","Art. No.","Page start","Page end","Page count","Cited by","DOI","Link","Document Type","Publication Stage","Open Access","Source","EID"
"Xu J.; Ma Q.","Xu, Jianhua (57194768618); Ma, Quan (57197704824)","57194768618; 57197704824","Multi-label regularized quadratic programming feature selection algorithm with Frank–Wolfe method","2018","Expert Systems with Applications","95","","","14","31","17","12","10.1016/j.eswa.2017.11.018","https://www.scopus.com/inward/record.uri?eid=2-s2.0-85034052124&doi=10.1016%2fj.eswa.2017.11.018&partnerID=40&md5=3ef086b3832acaeefa935cbf3de78e64","Article","Final","","Scopus","2-s2.0-85034052124"
"Do T.-T.; Hoang T.; Pomponiu V.; Zhou Y.; Chen Z.; Cheung N.-M.; Koh D.; Tan A.; Tan S.-H.","Do, Thanh-Toan (56647672700); Hoang, Tuan (57197846978); Pomponiu, Victor (42662218200); Zhou, Yiren (57701003600); Chen, Zhao (57202712613); Cheung, Ngai-Man (8945369100); Koh, Dawn (56121719300); Tan, Aaron (42262883400); Tan, Suat-Hoon (57226382303)","56647672700; 57197846978; 42662218200; 57701003600; 57202712613; 8945369100; 56121719300; 42262883400; 57226382303","Accessible Melanoma Detection Using Smartphones and Mobile Image Analysis","2018","IEEE Transactions on Multimedia","20","10","8316868","2849","2864","15","58","10.1109/TMM.2018.2814346","https://www.scopus.com/inward/record.uri?eid=2-s2.0-85043766805&doi=10.1109%2fTMM.2018.2814346&partnerID=40&md5=a0e895fe291c7320bed45a21ff495f1a","Article","Final","All Open Access; Green Open Access","Scopus","2-s2.0-85043766805"
"Rescio G.; Leone A.; Siciliano P.","Rescio, Gabriele (26768330400); Leone, Alessandro (7102613483); Siciliano, Pietro (7004477925)","26768330400; 7102613483; 7004477925","Supervised machine learning scheme for electromyography-based pre-fall detection system","2018","Expert Systems with Applications","100","","","95","105","10","64","10.1016/j.eswa.2018.01.047","https://www.scopus.com/inward/record.uri?eid=2-s2.0-85041533707&doi=10.1016%2fj.eswa.2018.01.047&partnerID=40&md5=a702a7068080b82c8e55d8a6a0f5e129","Article","Final","","Scopus","2-s2.0-85041533707"
"Lausser L.; Szekely R.; Kessler V.; Schwenker F.; Kestler H.A.","Lausser, Ludwig (25522265700); Szekely, Robin (57195989597); Kessler, Viktor (56414477600); Schwenker, Friedhelm (6701325661); Kestler, Hans A. (7004325203)","25522265700; 57195989597; 56414477600; 6701325661; 7004325203","Selecting features from foreign classes","2018","Lecture Notes in Computer Science (including subseries Lecture Notes in Artificial Intelligence and Lecture Notes in Bioinformatics)","11081 LNAI","","","66","77","11","2","10.1007/978-3-319-99978-4_5","https://www.scopus.com/inward/record.uri?eid=2-s2.0-85053609963&doi=10.1007%2f978-3-319-99978-4_5&partnerID=40&md5=ef71e73abe45211b4853be423a17d015","Conference paper","Final","","Scopus","2-s2.0-85053609963"
"Dagliati A.; Marini S.; Sacchi L.; Cogni G.; Teliti M.; Tibollo V.; De Cata P.; Chiovato L.; Bellazzi R.","Dagliati, Arianna (57192824262); Marini, Simone (53981812300); Sacchi, Lucia (57192331744); Cogni, Giulia (55652512900); Teliti, Marsida (57195218724); Tibollo, Valentina (39763027500); De Cata, Pasquale (6507919393); Chiovato, Luca (7004284732); Bellazzi, Riccardo (58709404600)","57192824262; 53981812300; 57192331744; 55652512900; 57195218724; 39763027500; 6507919393; 7004284732; 58709404600","Machine Learning Methods to Predict Diabetes Complications","2018","Journal of Diabetes Science and Technology","12","2","","295","302","7","266","10.1177/1932296817706375","https://www.scopus.com/inward/record.uri?eid=2-s2.0-85042196404&doi=10.1177%2f1932296817706375&partnerID=40&md5=1bce5db4614d6e725285f2acf22a3f03","Article","Final","All Open Access; Bronze Open Access; Green Open Access","Scopus","2-s2.0-85042196404"
"Kamalov F.; Thabtah F.","Kamalov, Firuz (55821119700); Thabtah, Fadi (8349253300)","55821119700; 8349253300","A Feature Selection Method Based on Ranked Vector Scores of Features for Classification","2017","Annals of Data Science","4","4","","483","502","19","45","10.1007/s40745-017-0116-1","https://www.scopus.com/inward/record.uri?eid=2-s2.0-85059967414&doi=10.1007%2fs40745-017-0116-1&partnerID=40&md5=556a7140d70aa10a217ae55591c7b959","Article","Final","","Scopus","2-s2.0-85059967414"
"Cui G.; Wu L.; Zhou T.; Gu Y.; Lu X.; Zhang B.; Zhao Y.; Yu D.; Gao L.","Cui, Guimei (8396663400); Wu, Liang (57203604225); Zhou, Tao (57204478992); Gu, Yu (57199810470); Lu, Xiaoqi (14039286600); Zhang, Baohua (55721022500); Zhao, Ying (56374524900); Yu, Dahua (53864510100); Gao, Lixin (57204481407)","8396663400; 57203604225; 57204478992; 57199810470; 14039286600; 55721022500; 56374524900; 53864510100; 57204481407","Automatic lung nodule detection using multi-scale dot nodule-enhancement filter and weighted support vector machines in chest computed tomography","2019","PLoS ONE","14","1","e0210551","","","","52","10.1371/journal.pone.0210551","https://www.scopus.com/inward/record.uri?eid=2-s2.0-85059828680&doi=10.1371%2fjournal.pone.0210551&partnerID=40&md5=bad9cc26b31442033fef1c57a3b939ec","Article","Final","All Open Access; Gold Open Access; Green Open Access","Scopus","2-s2.0-85059828680"
"Raza H.; Faizan M.; Hamza A.; Mushtaq A.; Akhtar N.","Raza, Hassan (57214221567); Faizan, M (59268013500); Hamza, Ahsan (57214223789); Mushtaq, Ahmed (56430353500); Akhtar, Naeem (56730082200)","57214221567; 59268013500; 57214223789; 56430353500; 56730082200","Scientific text sentiment analysis using machine learning techniques","2019","International Journal of Advanced Computer Science and Applications","10","12","","157","165","8","58","10.14569/ijacsa.2019.0101222","https://www.scopus.com/inward/record.uri?eid=2-s2.0-85078476128&doi=10.14569%2fijacsa.2019.0101222&partnerID=40&md5=406eb13ad19710814166657f4d14d45f","Article","Final","All Open Access; Gold Open Access","Scopus","2-s2.0-85078476128"
"Azeem M.; Usman M.; Fong A.C.M.","Azeem, Muhammad (56030100300); Usman, Muhammad (56844860100); Fong, A.C.M. (7004317340)","56030100300; 56844860100; 7004317340","A churn prediction model for prepaid customers in telecom using fuzzy classifiers","2017","Telecommunication Systems","66","4","","603","614","11","47","10.1007/s11235-017-0310-7","https://www.scopus.com/inward/record.uri?eid=2-s2.0-85016392578&doi=10.1007%2fs11235-017-0310-7&partnerID=40&md5=8dff8037ef85fc55b24bf8d992eafeed","Article","Final","","Scopus","2-s2.0-85016392578"
"Long X.; Jeliazkov J.R.; Gray J.J.","Long, Xiyao (57205391604); Jeliazkov, Jeliazko R. (56308107000); Gray, Jeffrey J. (7404300143)","57205391604; 56308107000; 7404300143","Non-H3 CDR template selection in antibody modeling through machine learning","2019","PeerJ","2019","1","e6179","","","","9","10.7717/peerj.6179","https://www.scopus.com/inward/record.uri?eid=2-s2.0-85059852635&doi=10.7717%2fpeerj.6179&partnerID=40&md5=a25471fc13b1ca57035480034aa405bc","Article","Final","All Open Access; Gold Open Access; Green Open Access","Scopus","2-s2.0-85059852635"
"Zhang Z.; Sun C.; Bridgelall R.; Sun M.","Zhang, Zhiming (56456966400); Sun, Chao (55921171700); Bridgelall, Raj (24512234400); Sun, Mingxuan (57195075410)","56456966400; 55921171700; 24512234400; 57195075410","Application of a machine learning method to evaluate road roughness from connected vehicles","2018","Journal of Transportation Engineering Part B: Pavements","144","4","04018043","","","","26","10.1061/JPEODX.0000074","https://www.scopus.com/inward/record.uri?eid=2-s2.0-85051518482&doi=10.1061%2fJPEODX.0000074&partnerID=40&md5=9a20762a5ed52fb433f2a8c11379c166","Article","Final","","Scopus","2-s2.0-85051518482"
"Solomon S.E.B.; de Farias M.R.; Pimpão C.T.","Solomon, Suzana Evelyn Bahr (57231463300); de Farias, Marconi Rodrigues (24167801700); Pimpão, Claudia Turra (6506509551)","57231463300; 24167801700; 6506509551","Use of staphylococcus aureus phage lysate staphage lysate (SPL)® for the control of recurrent pyoderma eczema in dogs with atopic dermatitis","2018","Acta Scientiae Veterinariae","44","1","1382","","","","9","10.22456/1679-9216.81103","https://www.scopus.com/inward/record.uri?eid=2-s2.0-85092691107&doi=10.22456%2f1679-9216.81103&partnerID=40&md5=69199e3aa6b64b7c00178cffd1804474","Article","Final","All Open Access; Green Open Access; Hybrid Gold Open Access","Scopus","2-s2.0-85092691107"
"Ahmad A.; Guyonneau R.; Mercier F.; Belin É.","Ahmad, Ali (59598166800); Guyonneau, Rémy (55421032500); Mercier, Franck (57202892202); Belin, Étienne (24921196600)","59598166800; 55421032500; 57202892202; 24921196600","An image processing method based on features selection for crop plants and weeds discrimination using RGB images","2018","Lecture Notes in Computer Science (including subseries Lecture Notes in Artificial Intelligence and Lecture Notes in Bioinformatics)","10884 LNCS","","","3","10","7","5","10.1007/978-3-319-94211-7_1","https://www.scopus.com/inward/record.uri?eid=2-s2.0-85049693165&doi=10.1007%2f978-3-319-94211-7_1&partnerID=40&md5=e2f3036cfb9bd6160797818b6f7b2bbc","Conference paper","Final","","Scopus","2-s2.0-85049693165"
"Wijaya S.H.; Batubara I.; Nishioka T.; Altaf-Ul-Amin M.; Kanaya S.","Wijaya, Sony Hartono (56118599900); Batubara, Irmanida (26031903000); Nishioka, Takaaki (7201616718); Altaf-Ul-Amin, Md. (6602333260); Kanaya, Shigehiko (7103034802)","56118599900; 26031903000; 7201616718; 6602333260; 7103034802","Metabolomic Studies of Indonesian Jamu Medicines: Prediction of Jamu Efficacy and Identification of Important Metabolites","2017","Molecular Informatics","36","12","1700050","","","","16","10.1002/minf.201700050","https://www.scopus.com/inward/record.uri?eid=2-s2.0-85021806845&doi=10.1002%2fminf.201700050&partnerID=40&md5=8874578aece57fb400ef0ec811e13758","Article","Final","","Scopus","2-s2.0-85021806845"
"Awais M.; Chiari L.; Ihlen E.A.F.; Helbostad J.L.; Palmerini L.","Awais, Muhammad (57224215215); Chiari, Lorenzo (6701379140); Ihlen, Espen Alexander F. (26642555000); Helbostad, Jorunn L. (55885414600); Palmerini, Luca (35787311000)","57224215215; 6701379140; 26642555000; 55885414600; 35787311000","Physical Activity Classification for Elderly People in Free-Living Conditions","2019","IEEE Journal of Biomedical and Health Informatics","23","1","8327491","197","207","10","63","10.1109/JBHI.2018.2820179","https://www.scopus.com/inward/record.uri?eid=2-s2.0-85044852024&doi=10.1109%2fJBHI.2018.2820179&partnerID=40&md5=62867e77a694636a0aae19d96f476383","Article","Final","All Open Access; Green Open Access","Scopus","2-s2.0-85044852024"
"Walkowiak T.; Malak P.","Walkowiak, Tomasz (22136569700); Malak, Piotr (55901594700)","22136569700; 55901594700","Polish texts topic classification evaluation","2018","ICAART 2018 - Proceedings of the 10th International Conference on Agents and Artificial Intelligence","2","","","515","522","7","17","10.5220/0006601605150522","https://www.scopus.com/inward/record.uri?eid=2-s2.0-85046660763&doi=10.5220%2f0006601605150522&partnerID=40&md5=b5c119a9b1945029f2b7bcd189fecfb8","Conference paper","Final","All Open Access; Green Open Access; Hybrid Gold Open Access","Scopus","2-s2.0-85046660763"
"Chung I.-F.; Chen Y.-C.; Pal N.R.","Chung, I-Fang (7201867967); Chen, Yi-Cheng (55932117900); Pal, Nikhil R. (35561327100)","7201867967; 55932117900; 35561327100","Feature Selection with Controlled Redundancy in a Fuzzy Rule Based Framework","2018","IEEE Transactions on Fuzzy Systems","26","2","","734","748","14","40","10.1109/TFUZZ.2017.2688358","https://www.scopus.com/inward/record.uri?eid=2-s2.0-85045006544&doi=10.1109%2fTFUZZ.2017.2688358&partnerID=40&md5=23128590b1915e2f7f438a9114783bd3","Article","Final","","Scopus","2-s2.0-85045006544"
"Xygonakis I.; Athanasiou A.; Pandria N.; Kugiumtzis D.; Bamidis P.D.","Xygonakis, Ioannis (57189295386); Athanasiou, Alkinoos (36536639300); Pandria, Niki (57095917200); Kugiumtzis, Dimitris (6603302704); Bamidis, Panagiotis D. (6603398831)","57189295386; 36536639300; 57095917200; 6603302704; 6603398831","Decoding Motor Imagery through Common Spatial Pattern Filters at the EEG Source Space","2018","Computational Intelligence and Neuroscience","2018","","7957408","","","","53","10.1155/2018/7957408","https://www.scopus.com/inward/record.uri?eid=2-s2.0-85051515147&doi=10.1155%2f2018%2f7957408&partnerID=40&md5=6c95a1073e9ccc017142c598cc773a1b","Article","Final","All Open Access; Gold Open Access; Green Open Access","Scopus","2-s2.0-85051515147"
"Zhou Q.; Wang M.; Ni J.; Ye Y.; Zuo W.","Zhou, Qifeng (55722099600); Wang, Maming (57211031352); Ni, Jinxin (57208573013); Ye, Yunyang (57203019001); Zuo, Wangda (25961077900)","55722099600; 57211031352; 57208573013; 57203019001; 25961077900","DdBB: A data-driven framework for building energy use benchmarking","2018","2018 IEEE International Conference on Information and Automation, ICIA 2018","","","8812519","716","721","5","1","10.1109/ICInfA.2018.8812519","https://www.scopus.com/inward/record.uri?eid=2-s2.0-85072319985&doi=10.1109%2fICInfA.2018.8812519&partnerID=40&md5=b7d6db43a2cf93e94d8a3834ea666662","Conference paper","Final","","Scopus","2-s2.0-85072319985"
"Abry P.; Spilka J.; Leonarduzzi R.; Chudáček V.; Pustelnik N.; Doret M.","Abry, P. (6701426529); Spilka, J. (26323797200); Leonarduzzi, R. (36718012900); Chudáček, V. (23388630100); Pustelnik, N. (26656132200); Doret, M. (6603316510)","6701426529; 26323797200; 36718012900; 23388630100; 26656132200; 6603316510","Sparse learning for Intrapartum fetal heart rate analysis","2018","Biomedical Physics and Engineering Express","4","3","034002","","","","23","10.1088/2057-1976/aabc64","https://www.scopus.com/inward/record.uri?eid=2-s2.0-85047266507&doi=10.1088%2f2057-1976%2faabc64&partnerID=40&md5=60b4be622bddedf210bf46e3c9088f20","Article","Final","All Open Access; Green Open Access","Scopus","2-s2.0-85047266507"
"Mahardhika Y.M.; Sudarsono A.; Barakbah A.R.","Mahardhika, Yesta Medya (57201943492); Sudarsono, Amang (45961439100); Barakbah, Ali Ridho (27367627700)","57201943492; 45961439100; 27367627700","An implementation of Botnet dataset to predict accuracy based on network flow model","2017","Proceedings - International Electronics Symposium on Knowledge Creation and Intelligent Computing, IES-KCIC 2017","2017-January","","","33","39","6","5","10.1109/KCIC.2017.8228455","https://www.scopus.com/inward/record.uri?eid=2-s2.0-85046542683&doi=10.1109%2fKCIC.2017.8228455&partnerID=40&md5=38041573b7cf8691464af835b4a8e30b","Conference paper","Final","","Scopus","2-s2.0-85046542683"
"Sidhu G.","Sidhu, Gagan (55377353500)","55377353500","Locally Linear Embedding and fMRI Feature Selection in Psychiatric Classification","2019","IEEE Journal of Translational Engineering in Health and Medicine","7","","8807145","","","","29","10.1109/JTEHM.2019.2936348","https://www.scopus.com/inward/record.uri?eid=2-s2.0-85072065302&doi=10.1109%2fJTEHM.2019.2936348&partnerID=40&md5=fc2719d9b04ba1b1ec8432fac802655b","Article","Final","All Open Access; Gold Open Access; Green Open Access","Scopus","2-s2.0-85072065302"
"Liu Y.; Munteanu C.R.; Yan Q.; Pedreira N.; Kang J.; Tang S.; Zhou C.; He Z.; Tan Z.","Liu, Yong (56608990100); Munteanu, Cristian R. (35230297200); Yan, Qiongxian (54409839500); Pedreira, Nieves (6507062168); Kang, Jinhe (55314357900); Tang, Shaoxun (25628660800); Zhou, Chuanshe (11939875300); He, Zhixiong (35191892400); Tan, Zhiliang (14631250800)","56608990100; 35230297200; 54409839500; 6507062168; 55314357900; 25628660800; 11939875300; 35191892400; 14631250800","Machine learning classification models for fetal skeletal development performance prediction using maternal bone metabolic proteins in goats","2019","PeerJ","2019","10","e7840","","","","3","10.7717/peerj.7840","https://www.scopus.com/inward/record.uri?eid=2-s2.0-85074144772&doi=10.7717%2fpeerj.7840&partnerID=40&md5=277e452d854815212932dfc61a6727e9","Article","Final","All Open Access; Gold Open Access; Green Open Access","Scopus","2-s2.0-85074144772"
"Normawati D.; Winarti S.","Normawati, Dwi (57200573804); Winarti, Sri (57201445773)","57200573804; 57201445773","Feature selection with combination classifier use rules-based data mining for diagnosis of coronary heart disease","2018","Proceeding of 2018 12th International Conference on Telecommunication Systems, Services, and Applications, TSSA 2018","","","8708849","","","","6","10.1109/TSSA.2018.8708849","https://www.scopus.com/inward/record.uri?eid=2-s2.0-85066895536&doi=10.1109%2fTSSA.2018.8708849&partnerID=40&md5=87037aa3b7c9ff30676adc636ea9213d","Conference paper","Final","","Scopus","2-s2.0-85066895536"
"Tournois L.; Chanaron J.-J.","Tournois, Laurent (55293676500); Chanaron, Jean-Jacques (6603532168)","55293676500; 6603532168","Car crisis and renewal: how Mercedes succeeded with the A-Class","2018","Journal of Business Strategy","39","1","","3","14","11","2","10.1108/JBS-03-2017-0033","https://www.scopus.com/inward/record.uri?eid=2-s2.0-85041543881&doi=10.1108%2fJBS-03-2017-0033&partnerID=40&md5=43b8e64dbf43aff57d91a806b3f50f6a","Article","Final","","Scopus","2-s2.0-85041543881"
"González-Rojas O.; Tafurth J.","González-Rojas, Oscar (57191347066); Tafurth, Juan (57213592000)","57191347066; 57213592000","Multi-cloud services configuration based on risk optimization","2019","Lecture Notes in Computer Science (including subseries Lecture Notes in Artificial Intelligence and Lecture Notes in Bioinformatics)","11877 LNCS","","","733","749","16","2","10.1007/978-3-030-33246-4_45","https://www.scopus.com/inward/record.uri?eid=2-s2.0-85077839535&doi=10.1007%2f978-3-030-33246-4_45&partnerID=40&md5=74e5cee5c2705da5d5abcd2947d4b6d6","Conference paper","Final","","Scopus","2-s2.0-85077839535"
"Marchese Robinson R.L.; Roberts K.J.; Martin E.B.","Marchese Robinson, Richard L. (39962040600); Roberts, Kevin J. (7402041838); Martin, Elaine B. (7404092696)","39962040600; 7402041838; 7404092696","The influence of solid state information and descriptor selection on statistical models of temperature dependent aqueous solubility","2018","Journal of Cheminformatics","10","1","44","","","","9","10.1186/s13321-018-0298-3","https://www.scopus.com/inward/record.uri?eid=2-s2.0-85052575974&doi=10.1186%2fs13321-018-0298-3&partnerID=40&md5=a683dce8a32466db4cea2413cf32a3ca","Article","Final","All Open Access; Gold Open Access; Green Open Access","Scopus","2-s2.0-85052575974"
"Uyun S.; Choridah L.","Uyun, Shofwatul (56069899800); Choridah, Lina (56069902100)","56069899800; 56069902100","Feature selection mammogram based on breast cancer mining","2018","International Journal of Electrical and Computer Engineering","8","1","","60","69","9","26","10.11591/ijece.v8i1.pp60-69","https://www.scopus.com/inward/record.uri?eid=2-s2.0-85040054352&doi=10.11591%2fijece.v8i1.pp60-69&partnerID=40&md5=77d75e8d1e04bee5453669aa31a223d9","Article","Final","All Open Access; Green Open Access","Scopus","2-s2.0-85040054352"
"Buongiorno D.; Bortone I.; Cascarano G.D.; Trotta G.F.; Brunetti A.; Bevilacqua V.","Buongiorno, Domenico (56401876300); Bortone, Ilaria (56347065600); Cascarano, Giacomo Donato (57194206620); Trotta, Gianpaolo Francesco (56913180700); Brunetti, Antonio (56912970400); Bevilacqua, Vitoantonio (57204703239)","56401876300; 56347065600; 57194206620; 56913180700; 56912970400; 57204703239","A low-cost vision system based on the analysis of motor features for recognition and severity rating of Parkinson's Disease","2019","BMC Medical Informatics and Decision Making","19","9","243","","","","70","10.1186/s12911-019-0987-5","https://www.scopus.com/inward/record.uri?eid=2-s2.0-85076405866&doi=10.1186%2fs12911-019-0987-5&partnerID=40&md5=faef4d4fc27af4d53dd495193e4177a4","Article","Final","All Open Access; Gold Open Access; Green Open Access","Scopus","2-s2.0-85076405866"
"Abbasi B.Z.","Abbasi, Bushra Zaheer (57200163789)","57200163789","Student research abstract: Fuzzy-rule based approach for feature selection in text classification","2019","Proceedings of the ACM Symposium on Applied Computing","Part F147772","","","553","555","2","0","10.1145/3297280.3297643","https://www.scopus.com/inward/record.uri?eid=2-s2.0-85065651220&doi=10.1145%2f3297280.3297643&partnerID=40&md5=8d44b54e1c026bb126885ab56087f55e","Conference paper","Final","","Scopus","2-s2.0-85065651220"
"Han E.-H.; Cha H.-T.","Han, Eui-Hwan (57205355737); Cha, Hyung-Tai (7103181648)","57205355737; 7103181648","Performance improvement in a classification method by using statistical pre-processing","2019","Journal of Institute of Control, Robotics and Systems","25","1","","69","75","6","2","10.5302/J.ICROS.2019.18.0196","https://www.scopus.com/inward/record.uri?eid=2-s2.0-85059696621&doi=10.5302%2fJ.ICROS.2019.18.0196&partnerID=40&md5=43a20d4de8d6b52f59076fb44d31276c","Article","Final","","Scopus","2-s2.0-85059696621"
"Thung K.-H.; Yap P.-T.; Adeli E.; Lee S.-W.; Shen D.","Thung, Kim-Han (9337867600); Yap, Pew-Thian (7102482475); Adeli, Ehsan (57205548034); Lee, Seong-Whan (7601390519); Shen, Dinggang (7401738392)","9337867600; 7102482475; 57205548034; 7601390519; 7401738392","Conversion and time-to-conversion predictions of mild cognitive impairment using low-rank affinity pursuit denoising and matrix completion","2018","Medical Image Analysis","45","","","68","82","14","86","10.1016/j.media.2018.01.002","https://www.scopus.com/inward/record.uri?eid=2-s2.0-85041459324&doi=10.1016%2fj.media.2018.01.002&partnerID=40&md5=4596eb8fb39a29cc966c47b35caafad7","Article","Final","All Open Access; Green Open Access","Scopus","2-s2.0-85041459324"
"Badria F.A.; Habib M.M.A.; Shoaip N.; Elmogy M.","Badria, Farid A. (7003748634); Habib, Mohamed M. Abu (58831570100); Shoaip, Nora (56441767600); Elmogy, Mohammed (33567709900)","7003748634; 58831570100; 56441767600; 33567709900","A framework for harmla alkaloid extraction process development using fuzzy-rough sets feature selection and J48 classification","2017","International Journal of Advanced Computer Research","7","33","","213","222","9","1","10.19101/IJACR.2017.733022","https://www.scopus.com/inward/record.uri?eid=2-s2.0-85044422030&doi=10.19101%2fIJACR.2017.733022&partnerID=40&md5=6fd0f9341827461a9e49fa8f661fdf88","Article","Final","","Scopus","2-s2.0-85044422030"
"Kocoń J.; Marcińczuk M.","Kocoń, Jan (55345399800); Marcińczuk, Michał (24832449400)","55345399800; 24832449400","Supervised approach to recognise Polish temporal expressions and rule-based interpretation of timexes","2017","Natural Language Engineering","23","3","","385","418","33","4","10.1017/S1351324916000255","https://www.scopus.com/inward/record.uri?eid=2-s2.0-84988693231&doi=10.1017%2fS1351324916000255&partnerID=40&md5=52c5a3b0d26baa7e00d828f47c350cf3","Article","Final","","Scopus","2-s2.0-84988693231"
"Yano K.; Suyama T.","Yano, Ken (35235771200); Suyama, Takayuki (7005990938)","35235771200; 7005990938","A Novel Fixed Low-Rank Constrained EEG Spatial Filter Estimation with Application to Movie-Induced Emotion Recognition","2016","Computational Intelligence and Neuroscience","2016","","6734720","","","","6","10.1155/2016/6734720","https://www.scopus.com/inward/record.uri?eid=2-s2.0-84983748534&doi=10.1155%2f2016%2f6734720&partnerID=40&md5=94b30b2363748b07b5f841570688edc0","Article","Final","All Open Access; Gold Open Access; Green Open Access","Scopus","2-s2.0-84983748534"
"Chaudhary A.; Basu S.; Kumar R.; Mahesh C.; Sharma R.","Chaudhary, Aditya (56539387400); Basu, Sujit (7403656261); Kumar, Raj (59123183500); Mahesh, C. (36704804900); Sharma, Rashmi (58728034900)","56539387400; 7403656261; 59123183500; 36704804900; 58728034900","Shape Classification of AltiKa 40-Hz Waveforms using Linear Discriminant Analysis and Bayes Decision Rule in the Gujarat Coastal Region","2015","Marine Geodesy","38","","","62","72","10","10","10.1080/01490419.2014.1001504","https://www.scopus.com/inward/record.uri?eid=2-s2.0-84928500751&doi=10.1080%2f01490419.2014.1001504&partnerID=40&md5=588babb4cdcf158017f868e61a9530e3","Article","Final","","Scopus","2-s2.0-84928500751"
"Hsieh K.-K.; Siatkowski S.; Wang L.-C.; Chen W.; Bhadra J.","Hsieh, Kuo-Kai (56717219600); Siatkowski, Sebastian (57056456800); Wang, Li-C. (55833691700); Chen, Wen (55556767100); Bhadra, Jayanta (6602380828)","56717219600; 57056456800; 55833691700; 55556767100; 6602380828","Feature extraction from design documents to enable rule learning for improving assertion coverage","2017","Proceedings of the Asia and South Pacific Design Automation Conference, ASP-DAC","","","7858295","51","56","5","4","10.1109/ASPDAC.2017.7858295","https://www.scopus.com/inward/record.uri?eid=2-s2.0-85015261832&doi=10.1109%2fASPDAC.2017.7858295&partnerID=40&md5=8c9e139a5bd887e38ef3753de3ef6a6d","Conference paper","Final","","Scopus","2-s2.0-85015261832"
"Zhai Y.; Ong Y.-S.; Tsang I.W.","Zhai, Yiteng (55377084500); Ong, Yew-Soon (7006735298); Tsang, Ivor W. (7004570429)","55377084500; 7006735298; 7004570429","Making Trillion Correlations Feasible in Feature Grouping and Selection","2016","IEEE Transactions on Pattern Analysis and Machine Intelligence","38","12","7415982","2472","2486","14","12","10.1109/TPAMI.2016.2533384","https://www.scopus.com/inward/record.uri?eid=2-s2.0-84995543411&doi=10.1109%2fTPAMI.2016.2533384&partnerID=40&md5=20fd1895204d51f3416d29623b1b9124","Article","Final","","Scopus","2-s2.0-84995543411"
