"Authors","Author full names","Author(s) ID","Title","Year","Source title","Volume","Issue","Art. No.","Page start","Page end","Page count","Cited by","DOI","Link","Document Type","Publication Stage","Open Access","Source","EID"
"Ravindranath V.; Ramasamy S.; Somula R.; Sahoo K.S.; Gandomi A.H.","Ravindranath, Vaishali (58045722300); Ramasamy, Sasikala (56644464500); Somula, Ramasubbareddy (57201195237); Sahoo, Kshira Sagar (57091357900); Gandomi, Amir H. (26421192100)","58045722300; 56644464500; 57201195237; 57091357900; 26421192100","Swarm Intelligence Based Feature Selection for Intrusion and Detection System in Cloud Infrastructure","2020","2020 IEEE Congress on Evolutionary Computation, CEC 2020 - Conference Proceedings","","","9185887","","","","27","10.1109/CEC48606.2020.9185887","https://www.scopus.com/inward/record.uri?eid=2-s2.0-85092068605&doi=10.1109%2fCEC48606.2020.9185887&partnerID=40&md5=838a0a22cf48fdd6194273593f37eb5e","Conference paper","Final","All Open Access; Green Open Access","Scopus","2-s2.0-85092068605"
"Loreto M.; Lisboa T.; Moreira V.P.","Loreto, Melina (57214724847); Lisboa, Thiago (14325655700); Moreira, Viviane P. (15769964500)","57214724847; 14325655700; 15769964500","Early prediction of ICU readmissions using classification algorithms","2020","Computers in Biology and Medicine","118","","103636","","","","38","10.1016/j.compbiomed.2020.103636","https://www.scopus.com/inward/record.uri?eid=2-s2.0-85078992522&doi=10.1016%2fj.compbiomed.2020.103636&partnerID=40&md5=c4732acacc78641f775258cc6e692bd8","Article","Final","All Open Access; Hybrid Gold Open Access","Scopus","2-s2.0-85078992522"
"Kar S.; Tanaka R.; Korbu L.B.; Kholová J.; Iwata H.; Durbha S.S.; Adinarayana J.; Vadez V.","Kar, Soumyashree (57200598841); Tanaka, Ryokei (57195986219); Korbu, Lijalem Balcha (23989203600); Kholová, Jana (35169959100); Iwata, Hiroyoshi (7401885655); Durbha, Surya S. (54999762600); Adinarayana, J. (6701417945); Vadez, Vincent (6602808470)","57200598841; 57195986219; 23989203600; 35169959100; 7401885655; 54999762600; 6701417945; 6602808470","Automated discretization of ‘transpiration restriction to increasing VPD’ features from outdoors high-throughput phenotyping data","2020","Plant Methods","16","1","140","","","","19","10.1186/s13007-020-00680-8","https://www.scopus.com/inward/record.uri?eid=2-s2.0-85092694578&doi=10.1186%2fs13007-020-00680-8&partnerID=40&md5=aa3a7bbfe6cc4c21f9b5654ada83b839","Article","Final","All Open Access; Gold Open Access; Green Open Access","Scopus","2-s2.0-85092694578"
"Estrada-Torres B.; Del-Rio-Ortega A.; Resinas M.; Ruiz-Cortes A.","Estrada-Torres, Bedilia (57191282590); Del-Rio-Ortega, Adela (36704589800); Resinas, Manuel (15021461000); Ruiz-Cortes, Antonio (15120180100)","57191282590; 36704589800; 15021461000; 15120180100","Modeling variability in the performance perspective of business processes","2021","IEEE Access","9","","9502734","111683","111703","20","2","10.1109/ACCESS.2021.3101575","https://www.scopus.com/inward/record.uri?eid=2-s2.0-85111606052&doi=10.1109%2fACCESS.2021.3101575&partnerID=40&md5=7589cc1f669697eb37de3bf2c74e2a81","Article","Final","All Open Access; Gold Open Access; Green Open Access","Scopus","2-s2.0-85111606052"
"Takahashi Y.; Ueki M.; Yamada M.; Tamiya G.; Motoike I.N.; Saigusa D.; Sakurai M.; Nagami F.; Ogishima S.; Koshiba S.; Kinoshita K.; Yamamoto M.; Tomita H.","Takahashi, Yuta (57189759415); Ueki, Masao (20735696900); Yamada, Makoto (57220849962); Tamiya, Gen (55978633300); Motoike, Ikuko N. (6602320250); Saigusa, Daisuke (25229230400); Sakurai, Miyuki (7401437438); Nagami, Fuji (57090702500); Ogishima, Soichi (6507241005); Koshiba, Seizo (7004306579); Kinoshita, Kengo (7402901232); Yamamoto, Masayuki (57203953929); Tomita, Hiroaki (35391757000)","57189759415; 20735696900; 57220849962; 55978633300; 6602320250; 25229230400; 7401437438; 57090702500; 6507241005; 7004306579; 7402901232; 57203953929; 35391757000","Improved metabolomic data-based prediction of depressive symptoms using nonlinear machine learning with feature selection","2020","Translational Psychiatry","10","1","157","","","","27","10.1038/s41398-020-0831-9","https://www.scopus.com/inward/record.uri?eid=2-s2.0-85084963127&doi=10.1038%2fs41398-020-0831-9&partnerID=40&md5=59ebdbbb64ac6d4b4d0bc1d410ce45c2","Article","Final","All Open Access; Gold Open Access; Green Open Access","Scopus","2-s2.0-85084963127"
"Liu D.; Cui Y.; Cao Z.; Chen Y.","Liu, Dongfang (57208211534); Cui, Yiming (57217076660); Cao, Zhiwen (57219548312); Chen, Yingjie (56545255300)","57208211534; 57217076660; 57219548312; 56545255300","Indoor Navigation for Mobile Agents: A Multimodal Vision Fusion Model","2020","Proceedings of the International Joint Conference on Neural Networks","","","9207265","","","","21","10.1109/IJCNN48605.2020.9207265","https://www.scopus.com/inward/record.uri?eid=2-s2.0-85093842835&doi=10.1109%2fIJCNN48605.2020.9207265&partnerID=40&md5=73187df61e251556c2d5a47d971d8b23","Conference paper","Final","","Scopus","2-s2.0-85093842835"
"Yuan F.; Lu L.; Zou Q.","Yuan, Fei (58454470700); Lu, Lin (57199037432); Zou, Quan (23391564900)","58454470700; 57199037432; 23391564900","Analysis of gene expression profiles of lung cancer subtypes with machine learning algorithms","2020","Biochimica et Biophysica Acta - Molecular Basis of Disease","1866","8","165822","","","","67","10.1016/j.bbadis.2020.165822","https://www.scopus.com/inward/record.uri?eid=2-s2.0-85084370445&doi=10.1016%2fj.bbadis.2020.165822&partnerID=40&md5=0a0aaf82d22d15d385e0f93b08891cb1","Article","Final","All Open Access; Bronze Open Access","Scopus","2-s2.0-85084370445"
"Kobylarz J.; Bird J.J.; Faria D.R.; Ribeiro E.P.; Ekárt A.","Kobylarz, Jhonatan (57215684622); Bird, Jordan J. (57203547990); Faria, Diego R. (26031469100); Ribeiro, Eduardo Parente (8339159800); Ekárt, Anikó (6603036791)","57215684622; 57203547990; 26031469100; 8339159800; 6603036791","Thumbs up, thumbs down: non-verbal human-robot interaction through real-time EMG classification via inductive and supervised transductive transfer learning","2020","Journal of Ambient Intelligence and Humanized Computing","11","12","","6021","6031","10","39","10.1007/s12652-020-01852-z","https://www.scopus.com/inward/record.uri?eid=2-s2.0-85081655281&doi=10.1007%2fs12652-020-01852-z&partnerID=40&md5=a717a41420357545111662c960d408b5","Article","Final","All Open Access; Hybrid Gold Open Access","Scopus","2-s2.0-85081655281"
"Garau N.; Paganelli C.; Summers P.; Choi W.; Alam S.; Lu W.; Fanciullo C.; Bellomi M.; Baroni G.; Rampinelli C.","Garau, Noemi (57205692969); Paganelli, Chiara (58100114700); Summers, Paul (7103106631); Choi, Wookjin (7402516217); Alam, Sadegh (57216353820); Lu, Wei (55453094700); Fanciullo, Cristiana (57190386264); Bellomi, Massimo (7006113018); Baroni, Guido (7006568878); Rampinelli, Cristiano (22942200900)","57205692969; 58100114700; 7103106631; 7402516217; 57216353820; 55453094700; 57190386264; 7006113018; 7006568878; 22942200900","External validation of radiomics-based predictive models in low-dose CT screening for early lung cancer diagnosis","2020","Medical Physics","47","9","","4125","4136","11","34","10.1002/mp.14308","https://www.scopus.com/inward/record.uri?eid=2-s2.0-85087163532&doi=10.1002%2fmp.14308&partnerID=40&md5=32d23e3a77690320b6d048d942c45790","Article","Final","All Open Access; Green Open Access","Scopus","2-s2.0-85087163532"
"Xiao P.; Li C.; Zhu L.; Zhang X.; Ma T.; Feng X.","Xiao, Pengfeng (55722986100); Li, Chengxi (57192072201); Zhu, Luijun (55965436800); Zhang, Xueliang (48762261800); Ma, Tengyao (57211459992); Feng, Xuezhi (12797849000)","55722986100; 57192072201; 55965436800; 48762261800; 57211459992; 12797849000","Multitemporal ensemble learning for snow cover extraction from high-spatial-resolution images in mountain areas","2020","International Journal of Remote Sensing","41","5","","1668","1691","23","7","10.1080/01431161.2019.1674458","https://www.scopus.com/inward/record.uri?eid=2-s2.0-85074026362&doi=10.1080%2f01431161.2019.1674458&partnerID=40&md5=f8442b10a36fa2877209021d42b3c857","Article","Final","","Scopus","2-s2.0-85074026362"
"Ibrahim R.A.; Abd Elaziz M.; Oliva D.; Lu S.","Ibrahim, Rehab Ali (57197826527); Abd Elaziz, Mohamed (57195591068); Oliva, Diego (55391699600); Lu, Songfeng (7404227579)","57197826527; 57195591068; 55391699600; 7404227579","An improved runner-root algorithm for solving feature selection problems based on rough sets and neighborhood rough sets","2020","Applied Soft Computing","97","","105517","","","","34","10.1016/j.asoc.2019.105517","https://www.scopus.com/inward/record.uri?eid=2-s2.0-85066284363&doi=10.1016%2fj.asoc.2019.105517&partnerID=40&md5=932681053c65b304c516810a0c9a9f46","Article","Final","","Scopus","2-s2.0-85066284363"
"Kokubo A.; Kuwabara M.; Nakajima H.; Tomitani N.; Yamashita S.; Shiga T.; Kario K.","Kokubo, Ayako (57216524372); Kuwabara, Mitsuo (48261344200); Nakajima, Hiroshi (55375832700); Tomitani, Naoko (57189644362); Yamashita, Shingo (57202878767); Shiga, Toshikazu (14056853600); Kario, Kazuomi (7102633390)","57216524372; 48261344200; 55375832700; 57189644362; 57202878767; 14056853600; 7102633390","Automatic detection algorithm for establishing standard to identify “surge blood pressure”","2020","Medical and Biological Engineering and Computing","58","6","","1393","1404","11","20","10.1007/s11517-020-02162-4","https://www.scopus.com/inward/record.uri?eid=2-s2.0-85083800657&doi=10.1007%2fs11517-020-02162-4&partnerID=40&md5=442f2b883da5870d8e640f748e55e70f","Article","Final","All Open Access; Green Open Access; Hybrid Gold Open Access","Scopus","2-s2.0-85083800657"
"Das P.; Roychowdhury A.; Das S.; Roychoudhury S.; Tripathy S.","Das, Pijush (56349923100); Roychowdhury, Anirban (56392688900); Das, Subhadeep (57198673960); Roychoudhury, Susanta (36804052300); Tripathy, Sucheta (12778065100)","56349923100; 56392688900; 57198673960; 36804052300; 12778065100","sigFeature: Novel Significant Feature Selection Method for Classification of Gene Expression Data Using Support Vector Machine and t Statistic","2020","Frontiers in Genetics","11","","247","","","","46","10.3389/fgene.2020.00247","https://www.scopus.com/inward/record.uri?eid=2-s2.0-85083498306&doi=10.3389%2ffgene.2020.00247&partnerID=40&md5=abf2c78f5e4d2eaad2e7d0b681ba42d4","Article","Final","All Open Access; Gold Open Access; Green Open Access","Scopus","2-s2.0-85083498306"
"Li J.; He S.; Guo F.; Zou Q.","Li, Jing (59649375700); He, Shida (57221646443); Guo, Fei (57214440930); Zou, Quan (23391564900)","59649375700; 57221646443; 57214440930; 23391564900","HSM6AP: a high-precision predictor for the Homo sapiens N6-methyladenosine (m^6 A) based on multiple weights and feature stitching","2021","RNA Biology","18","11","","1882","1892","10","24","10.1080/15476286.2021.1875180","https://www.scopus.com/inward/record.uri?eid=2-s2.0-85100851887&doi=10.1080%2f15476286.2021.1875180&partnerID=40&md5=5088bcce58f2bcd697731e50a4d0c310","Article","Final","All Open Access; Bronze Open Access; Green Open Access","Scopus","2-s2.0-85100851887"
"Omoregbe N.A.I.; Ndaman I.O.; Misra S.; Abayomi-Alli O.O.; Damaševičius R.","Omoregbe, Nicholas A.I. (56155748000); Ndaman, Israel O. (57223024920); Misra, Sanjay (56962766700); Abayomi-Alli, Olusola O. (56811478400); Damaševičius, Robertas (6603451290)","56155748000; 57223024920; 56962766700; 56811478400; 6603451290","Text messaging-based medical diagnosis using natural language processing and fuzzy logic","2020","Journal of Healthcare Engineering","2020","","8839524","","","","72","10.1155/2020/8839524","https://www.scopus.com/inward/record.uri?eid=2-s2.0-85104532134&doi=10.1155%2f2020%2f8839524&partnerID=40&md5=955d8e73e979721f086476224214dda9","Article","Final","All Open Access; Hybrid Gold Open Access","Scopus","2-s2.0-85104532134"
"Zhang Z.; Qiu H.; Li W.; Chen Y.","Zhang, Zhen (57221190286); Qiu, Hang (23091925700); Li, Weihao (57191042767); Chen, Yucheng (26424909800)","57221190286; 23091925700; 57191042767; 26424909800","A stacking-based model for predicting 30-day all-cause hospital readmissions of patients with acute myocardial infarction","2020","BMC Medical Informatics and Decision Making","20","1","335","","","","27","10.1186/s12911-020-01358-w","https://www.scopus.com/inward/record.uri?eid=2-s2.0-85098475760&doi=10.1186%2fs12911-020-01358-w&partnerID=40&md5=f12d20a0e5f691eae1847f9e5d1eb156","Article","Final","All Open Access; Gold Open Access; Green Open Access","Scopus","2-s2.0-85098475760"
"Kok Z.H.; Shariff A.R.B.M.; Khairunniza-Bejo S.; Kim H.-T.; Ahamed T.; Cheah S.S.; Wahid S.A.A.","Kok, Zhi Hong (57224112020); Shariff, Abdul Rashid Bin Mohamed (13612157400); Khairunniza-Bejo, Siti (8394157300); Kim, Hyeon-Tae (8662923200); Ahamed, Tofael (9269729600); Cheah, See Siang (57207764503); Wahid, Siti Aishah Abd (57211470459)","57224112020; 13612157400; 8394157300; 8662923200; 9269729600; 57207764503; 57211470459","Plot-based classification of macronutrient levels in oil palm trees with landsat-8 images and machine learning","2021","Remote Sensing","13","11","2029","","","","8","10.3390/rs13112029","https://www.scopus.com/inward/record.uri?eid=2-s2.0-85107007013&doi=10.3390%2frs13112029&partnerID=40&md5=2150e311ec4430be707dfe2077d6c818","Article","Final","All Open Access; Gold Open Access; Green Open Access","Scopus","2-s2.0-85107007013"
"Lipu M.S.H.; Miah M.S.; Hannan M.A.; Hussain A.; Sarker M.R.; Ayob A.; Saad M.H.M.; Mahmud M.S.","Lipu, M. S. Hossain (58562396100); Miah, Md. Sazal (57226266149); Hannan, M.A. (7103014445); Hussain, Aini (57208481391); Sarker, Mahidur R. (37122644300); Ayob, Afida (26666566900); Saad, Mohamad Hanif Md (7202075525); Mahmud, Md. Sultan (57220492528)","58562396100; 57226266149; 7103014445; 57208481391; 37122644300; 26666566900; 7202075525; 57220492528","Artificial Intelligence Based Hybrid Forecasting Approaches for Wind Power Generation: Progress, Challenges and Prospects","2021","IEEE Access","9","","9483904","102460","102489","29","62","10.1109/ACCESS.2021.3097102","https://www.scopus.com/inward/record.uri?eid=2-s2.0-85110853330&doi=10.1109%2fACCESS.2021.3097102&partnerID=40&md5=b08744e41dfa01fa4c059d215402ca28","Article","Final","All Open Access; Gold Open Access","Scopus","2-s2.0-85110853330"
"Song W.; Jung S.Y.; Baek H.; Choi C.W.; Jung Y.H.; Yoo S.","Song, Wongeun (57209332970); Jung, Se Young (56660153400); Baek, Hyunyoung (55759155100); Choi, Chang Won (15046515100); Jung, Young Hwa (55445717400); Yoo, Sooyoung (8426359900)","57209332970; 56660153400; 55759155100; 15046515100; 55445717400; 8426359900","A predictive model based on machine learning for the early detection of late-onset neonatal sepsis: Development and observational study","2020","JMIR Medical Informatics","8","7","e15965","","","","30","10.2196/15965","https://www.scopus.com/inward/record.uri?eid=2-s2.0-85097462875&doi=10.2196%2f15965&partnerID=40&md5=9c7aa57a8a9ac236e9208999423a3406","Article","Final","All Open Access; Gold Open Access; Green Open Access","Scopus","2-s2.0-85097462875"
"Makwana A.","Makwana, Ashwin (57193611162)","57193611162","Efficient reasoner performance prediction using multi-label learning","2021","CEUR Workshop Proceedings","2786","","","304","313","9","0","","https://www.scopus.com/inward/record.uri?eid=2-s2.0-85102507667&partnerID=40&md5=7e36bda8df7c27dbaba04e593607d5e9","Conference paper","Final","","Scopus","2-s2.0-85102507667"
"Reščič N.; Eftimov T.; Seljak B.K.; Luštrek M.","Reščič, Nina (57205027224); Eftimov, Tome (56178012800); Seljak, Barbara Koroušić (55667062500); Luštrek, Mitja (12796966600)","57205027224; 56178012800; 55667062500; 12796966600","Optimising an ffq using a machine learning pipeline to teach an efficient nutrient intake predictive model","2020","Nutrients","12","12","3789","1","16","15","6","10.3390/nu12123789","https://www.scopus.com/inward/record.uri?eid=2-s2.0-85097426057&doi=10.3390%2fnu12123789&partnerID=40&md5=4b3aa22a7d0beaaf777cf766bd6d71f9","Article","Final","All Open Access; Gold Open Access; Green Open Access","Scopus","2-s2.0-85097426057"
"Cheng F.-Y.; Joshi H.; Tandon P.; Freeman R.; Reich D.L.; Mazumdar M.; Kohli-seth R.; Levin M.; Timsina P.; Kia A.","Cheng, Fu-Yuan (57218268013); Joshi, Himanshu (55221901200); Tandon, Pranai (57219010325); Freeman, Robert (57215489886); Reich, David L. (35480949200); Mazumdar, Madhu (35944668400); Kohli-seth, Roopa (8603789600); Levin, Matthew (36890238600); Timsina, Prem (57219343719); Kia, Arash (37109863300)","57218268013; 55221901200; 57219010325; 57215489886; 35480949200; 35944668400; 8603789600; 36890238600; 57219343719; 37109863300","Using machine learning to predict ICU transfer in hospitalized COVID-19 patients","2020","Journal of Clinical Medicine","9","6","1668","","","","141","10.3390/jcm9061668","https://www.scopus.com/inward/record.uri?eid=2-s2.0-85092016666&doi=10.3390%2fjcm9061668&partnerID=40&md5=fd3c92597d154bccfbde4454a5b4ac64","Article","Final","All Open Access; Gold Open Access; Green Open Access","Scopus","2-s2.0-85092016666"
"Shi M.; Wang J.; Zhang C.","Shi, Mingguang (8330620200); Wang, Junwen (57211409851); Zhang, Chenyu (57211406005)","8330620200; 57211409851; 57211406005","Integration of Cancer Genomics Data for Tree-based Dimensionality Reduction and Cancer Outcome Prediction","2020","Molecular Informatics","39","3","1900028","","","","10","10.1002/minf.201900028","https://www.scopus.com/inward/record.uri?eid=2-s2.0-85073784936&doi=10.1002%2fminf.201900028&partnerID=40&md5=b086fe8c2c9ae47383ba00f186f2c328","Article","Final","","Scopus","2-s2.0-85073784936"
"Khasidashvili Z.; Norman A.J.","Khasidashvili, Zurab (6603352074); Norman, Adam J. (7401492161)","6603352074; 7401492161","Range analysis and applications to root causing","2019","Proceedings - 2019 IEEE International Conference on Data Science and Advanced Analytics, DSAA 2019","","","8964195","298","307","9","3","10.1109/DSAA.2019.00045","https://www.scopus.com/inward/record.uri?eid=2-s2.0-85079274442&doi=10.1109%2fDSAA.2019.00045&partnerID=40&md5=075a793d6293ee158f0bc242130f2c0b","Conference paper","Final","","Scopus","2-s2.0-85079274442"
"Song J.; Wang Y.; Li F.; Akutsu T.; Rawlings N.D.; Webb G.I.; Chou K.-C.","Song, Jiangning (56023619300); Wang, Yanan (57195038915); Li, Fuyi (57198720015); Akutsu, Tatsuya (7102080520); Rawlings, Neil D (56639282800); Webb, Geoffrey I (7201584558); Chou, Kuo-Chen (7201905167)","56023619300; 57195038915; 57198720015; 7102080520; 56639282800; 7201584558; 7201905167","IProt-Sub: A comprehensive package for accurately mapping and predicting protease-specific substrates and cleavage sites","2019","Briefings in Bioinformatics","20","2","","638","658","20","167","10.1093/bib/bby028","https://www.scopus.com/inward/record.uri?eid=2-s2.0-85067539718&doi=10.1093%2fbib%2fbby028&partnerID=40&md5=47cbc3b8dae45a76f9374f14143c107d","Article","Final","All Open Access; Green Open Access; Hybrid Gold Open Access","Scopus","2-s2.0-85067539718"
"Lin J.; Sibley A.; Shterev I.; Nixon A.; Innocenti F.; Chan C.; Owzar K.","Lin, Jiaxing (57204194484); Sibley, Alexander (56647835400); Shterev, Ivo (8583589100); Nixon, Andrew (7103026806); Innocenti, Federico (7005085876); Chan, Cliburn (7404814671); Owzar, Kouros (8955283900)","57204194484; 56647835400; 8583589100; 7103026806; 7005085876; 7404814671; 8955283900","FastJT: An R package for robust and efficient feature selection for machine learning and genome-wide association studies","2019","BMC Bioinformatics","20","1","333","","","","3","10.1186/s12859-019-2869-3","https://www.scopus.com/inward/record.uri?eid=2-s2.0-85067251536&doi=10.1186%2fs12859-019-2869-3&partnerID=40&md5=f2f4e8e24627d5def5947dee18b5a160","Article","Final","All Open Access; Gold Open Access; Green Open Access","Scopus","2-s2.0-85067251536"
"Nemet S.; Kukolj D.; Ostojić G.; Stankovski S.; Jovanović D.","Nemet, Sandra (57203991617); Kukolj, Dragan (55879884500); Ostojić, Gordana (36851842800); Stankovski, Stevan (24605510200); Jovanović, Dragan (36518776900)","57203991617; 55879884500; 36851842800; 24605510200; 36518776900","Aggregation framework for TSK fuzzy and association rules: interpretability improvement on a traffic accidents case","2019","Applied Intelligence","49","11","","3909","3922","13","17","10.1007/s10489-019-01485-6","https://www.scopus.com/inward/record.uri?eid=2-s2.0-85065655199&doi=10.1007%2fs10489-019-01485-6&partnerID=40&md5=ef150d86189403ede25c0146c7ffddb8","Article","Final","","Scopus","2-s2.0-85065655199"
"Zhou C.; Wei H.","Zhou, Cheng (57221165176); Wei, Hongqin (36656693700)","57221165176; 36656693700","Evaluating and Classifying Patent Values Based on Self-Organizing Maps and Support Vector Machine; [专利价值评估与分类研究——基于自组织映射支持向量机]","2019","Data Analysis and Knowledge Discovery","3","5","","117","124","7","2","10.11925/infotech.2096-3467.2018.0674","https://www.scopus.com/inward/record.uri?eid=2-s2.0-85164727096&doi=10.11925%2finfotech.2096-3467.2018.0674&partnerID=40&md5=266089c4598770cff6a0d51019059be7","Article","Final","","Scopus","2-s2.0-85164727096"
"Gronsbell J.; Minnier J.; Yu S.; Liao K.; Cai T.","Gronsbell, Jessica (55791327800); Minnier, Jessica (36632638500); Yu, Sheng (56324605100); Liao, Katherine (7203022764); Cai, Tianxi (7102610149)","55791327800; 36632638500; 56324605100; 7203022764; 7102610149","Automated feature selection of predictors in electronic medical records data","2019","Biometrics","75","1","","268","277","9","26","10.1111/biom.12987","https://www.scopus.com/inward/record.uri?eid=2-s2.0-85061025010&doi=10.1111%2fbiom.12987&partnerID=40&md5=676724b5567b39c7e0c60ad7626dfc9c","Article","Final","","Scopus","2-s2.0-85061025010"
"Rajasekaran S.; Sathyabama S.","Rajasekaran, S. (59571905100); Sathyabama, S. (38862823200)","59571905100; 38862823200","Neighbor embedding feature selected light gradient boosting classification for breast cancer detection with gene expression data","2019","International Journal of Innovative Technology and Exploring Engineering","8","11 Special Issue","","645","654","9","0","10.35940/ijitee.K1108.09811S19","https://www.scopus.com/inward/record.uri?eid=2-s2.0-85073414792&doi=10.35940%2fijitee.K1108.09811S19&partnerID=40&md5=042bd40628d66b138160ef0fd0d9bf77","Article","Final","All Open Access; Gold Open Access","Scopus","2-s2.0-85073414792"
"Placzek A.; Pluciennik A.; Kotecka-Blicharz A.; Jarzab M.; Mrozek D.","Placzek, Aleksander (57189027926); Pluciennik, Alicja (57194728202); Kotecka-Blicharz, Agnieszka (57156619600); Jarzab, Michal (6507268441); Mrozek, Dariusz (57203881381)","57189027926; 57194728202; 57156619600; 6507268441; 57203881381","Bayesian Assessment of Diagnostic Strategy for a Thyroid Nodule Involving a Combination of Clinical Synthetic Features and Molecular Data","2020","IEEE Access","8","","","175125","175139","14","3","10.1109/ACCESS.2020.3026315","https://www.scopus.com/inward/record.uri?eid=2-s2.0-85098461283&doi=10.1109%2fACCESS.2020.3026315&partnerID=40&md5=6b471ea17455b8c33d93f0b51d120348","Article","Final","All Open Access; Gold Open Access","Scopus","2-s2.0-85098461283"
"Hassanein A.M.D.E.; Nour M.","Hassanein, Ahmed M. D. E. (55329184400); Nour, Mohamed (56027613700)","55329184400; 56027613700","A proposed model of selecting features for classifying Arabic text","2019","Jordanian Journal of Computers and Information Technology","5","3","","275","290","15","8","10.5455/jjcit.71-1564059469","https://www.scopus.com/inward/record.uri?eid=2-s2.0-85075921123&doi=10.5455%2fjjcit.71-1564059469&partnerID=40&md5=be96a483d09e38badc0ca36bfb3262b8","Article","Final","All Open Access; Gold Open Access","Scopus","2-s2.0-85075921123"
"Feeny A.K.; Rickard J.; Patel D.; Toro S.; Trulock K.M.; Park C.J.; Labarbera M.A.; Varma N.; Niebauer M.J.; Sinha S.; Gorodeski E.Z.; Grimm R.A.; Ji X.; Barnard J.; Madabhushi A.; Spragg D.D.; Chung M.K.","Feeny, Albert K. (55303740300); Rickard, John (35337607100); Patel, Divyang (55425389500); Toro, Saleem (57190680218); Trulock, Kevin M. (56323932900); Park, Carolyn J. (59074611600); Labarbera, Michael A. (57209687339); Varma, Niraj (7006007792); Niebauer, Mark J. (7003948356); Sinha, Sunil (35421091600); Gorodeski, Eiran Z. (9043777900); Grimm, Richard A. (7202638408); Ji, Xinge (57197866185); Barnard, John (35363655500); Madabhushi, Anant (6603019206); Spragg, David D. (6505911626); Chung, Mina K. (7402437323)","55303740300; 35337607100; 55425389500; 57190680218; 56323932900; 59074611600; 57209687339; 7006007792; 7003948356; 35421091600; 9043777900; 7202638408; 57197866185; 35363655500; 6603019206; 6505911626; 7402437323","Machine Learning Prediction of Response to Cardiac Resynchronization Therapy: Improvement Versus Current Guidelines","2019","Circulation: Arrhythmia and Electrophysiology","12","7","e007316","","","","91","10.1161/CIRCEP.119.007316","https://www.scopus.com/inward/record.uri?eid=2-s2.0-85068456706&doi=10.1161%2fCIRCEP.119.007316&partnerID=40&md5=f534727ce5940f3730e9bffc59e6556e","Article","Final","All Open Access; Green Open Access","Scopus","2-s2.0-85068456706"
"Arora S.V.; Vig R.","Arora, Sanghamitra V. (57195318325); Vig, Rekha (36440368400)","57195318325; 36440368400","An efficient text-independent speaker verification for short utterance data from Mobile devices","2020","Multimedia Tools and Applications","79","3-4","","3049","3074","25","2","10.1007/s11042-019-08196-7","https://www.scopus.com/inward/record.uri?eid=2-s2.0-85076396990&doi=10.1007%2fs11042-019-08196-7&partnerID=40&md5=9b0231035b507c8a3d2a1f3a9652273e","Article","Final","","Scopus","2-s2.0-85076396990"
