"Authors","Author full names","Author(s) ID","Title","Year","Source title","Volume","Issue","Art. No.","Page start","Page end","Page count","Cited by","DOI","Link","Document Type","Publication Stage","Open Access","Source","EID"
"Siegmund N.; Rosenmüller M.; Kästner C.; Giarrusso P.G.; Apel S.; Kolesnikov S.S.","Siegmund, Norbert (25825645900); Rosenmüller, Marko (35240944800); Kästner, Christian (35547901100); Giarrusso, Paolo G. (22734039100); Apel, Sven (8725218400); Kolesnikov, Sergiy S. (36451024500)","25825645900; 35240944800; 35547901100; 22734039100; 8725218400; 36451024500","Scalable prediction of non-functional properties in software product lines: Footprint and memory consumption","2013","Information and Software Technology","55","3","","491","507","16","64","10.1016/j.infsof.2012.07.020","https://www.scopus.com/inward/record.uri?eid=2-s2.0-84872961131&doi=10.1016%2fj.infsof.2012.07.020&partnerID=40&md5=6b156f0c57fa225ac4233c5604b091d6","Conference paper","Final","","Scopus","2-s2.0-84872961131"
"Zanardini D.; Albert E.; Villela K.","Zanardini, Damiano (17347009000); Albert, Elvira (8958526100); Villela, Karina (8846895200)","17347009000; 8958526100; 8846895200","Resource-usage-aware configuration in software product lines","2016","Journal of Logical and Algebraic Methods in Programming","85","1","","173","199","26","3","10.1016/j.jlamp.2015.08.003","https://www.scopus.com/inward/record.uri?eid=2-s2.0-84961584133&doi=10.1016%2fj.jlamp.2015.08.003&partnerID=40&md5=9c1a0f4a5f3569addc00d91678064641","Article","Final","","Scopus","2-s2.0-84961584133"
"Siegmund N.; Mory M.; Feigenspan J.; Saake G.; Nykolaychuk M.; Schumann M.","Siegmund, Norbert (25825645900); Mory, Maik (55213186700); Feigenspan, Janet (35112938100); Saake, Gunter (7004621677); Nykolaychuk, Mykhaylo (55247420100); Schumann, Marco (56747462100)","25825645900; 55213186700; 35112938100; 7004621677; 55247420100; 56747462100","Interoperability of non-functional requirements in complex systems","2012","2012 2nd International Workshop on Software Engineering for Embedded Systems, SEES 2012 - Proceedings","","","6225487","2","8","6","4","10.1109/SEES.2012.6225487","https://www.scopus.com/inward/record.uri?eid=2-s2.0-84864134426&doi=10.1109%2fSEES.2012.6225487&partnerID=40&md5=8ec648323fb3fda7b7ab83a6c8fe29f5","Conference paper","Final","","Scopus","2-s2.0-84864134426"
"Pereira J.A.; Schulze S.; Figueiredo E.; Saake G.","Pereira, Juliana Alves (56023378200); Schulze, Sandro (35225243700); Figueiredo, Eduardo (18433988600); Saake, Gunter (7004621677)","56023378200; 35225243700; 18433988600; 7004621677","N-dimensional tensor factorization for self-configuration of software product lines at runtime","2018","ACM International Conference Proceeding Series","1","","","87","97","10","8","10.1145/3233027.3233039","https://www.scopus.com/inward/record.uri?eid=2-s2.0-85055511805&doi=10.1145%2f3233027.3233039&partnerID=40&md5=f63a1f7a066dab0746961abbd9351245","Conference paper","Final","","Scopus","2-s2.0-85055511805"
"Lu H.; Yue T.; Ali S.; Nie K.; Zhang L.","Lu, Hong (57126555700); Yue, Tao (25651096400); Ali, Shaukat (56962801700); Nie, Kunming (55029941300); Zhang, Li (59157666600)","57126555700; 25651096400; 56962801700; 55029941300; 59157666600","Zen-CC: An automated and incremental conformance checking solution to support interactive product configuration","2014","Proceedings - International Symposium on Software Reliability Engineering, ISSRE","","","6982350","13","22","9","12","10.1109/ISSRE.2014.13","https://www.scopus.com/inward/record.uri?eid=2-s2.0-84928673057&doi=10.1109%2fISSRE.2014.13&partnerID=40&md5=ec4792a4bac14b939d09692579def015","Conference paper","Final","","Scopus","2-s2.0-84928673057"
"Nestor D.; O'Malley L.; Healy P.; Quigley A.; Thiel S.","Nestor, Daren (24829815500); O'Malley, Luke (36125596600); Healy, Patrick (34770477900); Quigley, Aaron (16239529900); Thiel, Steffen (24829590000)","24829815500; 36125596600; 34770477900; 16239529900; 24829590000","Visualisation techniques to support derivation tasks in software product line development","2007","Proceedings of the 2007 Conference of the Center for Advanced Studies on Collaborative Research, CASCON '07","","","","315","325","10","4","10.1145/1321211.1321255","https://www.scopus.com/inward/record.uri?eid=2-s2.0-77953576525&doi=10.1145%2f1321211.1321255&partnerID=40&md5=611b1834c14f8af7f94dac045640bda4","Conference paper","Final","","Scopus","2-s2.0-77953576525"
