"Authors","Author full names","Author(s) ID","Title","Year","Source title","Volume","Issue","Art. No.","Page start","Page end","Page count","Cited by","DOI","Link","Document Type","Publication Stage","Open Access","Source","EID"
"Alves Pereira J.; Acher M.; Martin H.; Jézéquel J.-M.","Alves Pereira, Juliana (56023378200); Acher, Mathieu (35758465800); Martin, Hugo (57211178917); Jézéquel, Jean-Marc (35618077100)","56023378200; 35758465800; 57211178917; 35618077100","Sampling effect on performance prediction of configurable systems: A case study","2020","ICPE 2020 - Proceedings of the ACM/SPEC International Conference on Performance Engineering","","","","277","288","11","43","10.1145/3358960.3379137","https://www.scopus.com/inward/record.uri?eid=2-s2.0-85085937290&doi=10.1145%2f3358960.3379137&partnerID=40&md5=8a19c36f93492287147e78e72bd0c59c","Conference paper","Final","","Scopus","2-s2.0-85085937290"
"Jamshidi P.; Siegmund N.; Velez M.; Kastner C.; Patel A.; Agarwal Y.","Jamshidi, Pooyan (34880055700); Siegmund, Norbert (25825645900); Velez, Miguel (57197252423); Kastner, Christian (35547901100); Patel, Akshay (57200511696); Agarwal, Yuvraj (57206496240)","34880055700; 25825645900; 57197252423; 35547901100; 57200511696; 57206496240","Transfer learning for performance modeling of configurable systems: An exploratory analysis","2017","ASE 2017 - Proceedings of the 32nd IEEE/ACM International Conference on Automated Software Engineering","","","8115661","497","508","11","94","10.1109/ASE.2017.8115661","https://www.scopus.com/inward/record.uri?eid=2-s2.0-85041373067&doi=10.1109%2fASE.2017.8115661&partnerID=40&md5=b192f5e2fe628c444c8ebdf92d387499","Conference paper","Final","All Open Access; Green Open Access","Scopus","2-s2.0-85041373067"
"Chen Y.; Gu Y.; He L.; Xuan J.","Chen, Yuntianyi (57214078114); Gu, Yongfeng (57193075894); He, Lulu (55904247400); Xuan, Jifeng (25640418400)","57214078114; 57193075894; 55904247400; 25640418400","Regression models for performance ranking of configurable systems: A comparative study","2020","Lecture Notes in Computer Science (including subseries Lecture Notes in Artificial Intelligence and Lecture Notes in Bioinformatics)","12028 LNCS","","","243","258","15","3","10.1007/978-3-030-41418-4_17","https://www.scopus.com/inward/record.uri?eid=2-s2.0-85081599711&doi=10.1007%2f978-3-030-41418-4_17&partnerID=40&md5=4b5613a9a5e6e5885dfc9e4040781dd4","Conference paper","Final","","Scopus","2-s2.0-85081599711"
"Kaltenecker C.; Grebhahn A.; Siegmund N.; Guo J.; Apel S.","Kaltenecker, Christian (57211018678); Grebhahn, Alexander (42161301000); Siegmund, Norbert (25825645900); Guo, Jianmei (55550120500); Apel, Sven (8725218400)","57211018678; 42161301000; 25825645900; 55550120500; 8725218400","Distance-Based Sampling of Software Configuration Spaces","2020","Lecture Notes in Informatics (LNI), Proceedings - Series of the Gesellschaft fur Informatik (GI)","P-300","","","61","64","3","2","10.18420/SE2020_17","https://www.scopus.com/inward/record.uri?eid=2-s2.0-85138680922&doi=10.18420%2fSE2020_17&partnerID=40&md5=d038285559fb3da6f9196361dfc530c5","Conference paper","Final","","Scopus","2-s2.0-85138680922"
"Pereira J.A.; Acher M.; Martin H.; Jézéquel J.-M.; Botterweck G.; Ventresque A.","Pereira, Juliana Alves (56023378200); Acher, Mathieu (35758465800); Martin, Hugo (57211178917); Jézéquel, Jean-Marc (35618077100); Botterweck, Goetz (24460344700); Ventresque, Anthony (23468296300)","56023378200; 35758465800; 57211178917; 35618077100; 24460344700; 23468296300","Learning software configuration spaces: A systematic literature review","2021","Journal of Systems and Software","182","","111044","","","","43","10.1016/j.jss.2021.111044","https://www.scopus.com/inward/record.uri?eid=2-s2.0-85114450561&doi=10.1016%2fj.jss.2021.111044&partnerID=40&md5=ecba3100562f3148699814dafb924493","Article","Final","All Open Access; Bronze Open Access; Green Open Access","Scopus","2-s2.0-85114450561"
"Clark W.D.K.; Syracuse K.C.; Visbisky M.","Clark, William D. K. (7403515619); Syracuse, Kenneth C. (6506672661); Visbisky, Mark (6506853384)","7403515619; 6506672661; 6506853384","A systems approach to creating reliable batteries for implantable medical applications","1997","Journal of Power Sources","65","1-2","","101","107","6","1","10.1016/S0378-7753(96)02602-X","https://www.scopus.com/inward/record.uri?eid=2-s2.0-0039504530&doi=10.1016%2fS0378-7753%2896%2902602-X&partnerID=40&md5=fd9f43a691e3dc4cde9f8629aa4425bb","Article","Final","","Scopus","2-s2.0-0039504530"
"Iorio F.; Hashemi A.B.; Tao M.; Amza C.","Iorio, Francesco (36902290400); Hashemi, Ali B. (57225333747); Tao, Michael (58024074100); Amza, Cristiana (12140701300)","36902290400; 57225333747; 58024074100; 12140701300","Transfer learning for cross-model regression in performance modeling for the cloud","2019","Proceedings of the International Conference on Cloud Computing Technology and Science, CloudCom","2019-December","","8968941","9","18","9","5","10.1109/CloudCom.2019.00015","https://www.scopus.com/inward/record.uri?eid=2-s2.0-85079043842&doi=10.1109%2fCloudCom.2019.00015&partnerID=40&md5=437b0028876194443c36003ffb92737b","Conference paper","Final","","Scopus","2-s2.0-85079043842"
"Pursley R.H.; Salem G.; Devasahayam N.; Subramanian S.; Koscielniak J.; Krishna M.C.; Pohida T.J.","Pursley, Randall H. (6603252385); Salem, Ghadi (7005224362); Devasahayam, Nallathamby (6701673098); Subramanian, Sankaran (7202867357); Koscielniak, Janusz (57071555200); Krishna, Murali C. (34668012300); Pohida, Thomas J. (6602241090)","6603252385; 7005224362; 6701673098; 7202867357; 57071555200; 34668012300; 6602241090","Integration of digital signal processing technologies with pulsed electron paramagnetic resonance imaging","2006","Journal of Magnetic Resonance","178","2","","220","227","7","10","10.1016/j.jmr.2005.10.001","https://www.scopus.com/inward/record.uri?eid=2-s2.0-30844463194&doi=10.1016%2fj.jmr.2005.10.001&partnerID=40&md5=672730740244763ee6901ebee1dd1025","Article","Final","All Open Access; Green Open Access","Scopus","2-s2.0-30844463194"
"Kaltenecker C.; Grebhahn A.; Siegmund N.; Guo J.; Apel S.","Kaltenecker, Christian (57211018678); Grebhahn, Alexander (42161301000); Siegmund, Norbert (25825645900); Guo, Jianmei (55550120500); Apel, Sven (8725218400)","57211018678; 42161301000; 25825645900; 55550120500; 8725218400","Distance-Based Sampling of Software Configuration Spaces","2019","Proceedings - International Conference on Software Engineering","2019-May","","8812049","1084","1094","10","81","10.1109/ICSE.2019.00112","https://www.scopus.com/inward/record.uri?eid=2-s2.0-85062345445&doi=10.1109%2fICSE.2019.00112&partnerID=40&md5=71d36cfab5860bb7aa9115117e32dd00","Conference paper","Final","","Scopus","2-s2.0-85062345445"
"Sarkar A.; Guo J.; Siegmund N.; Apel S.; Czarnecki K.","Sarkar, Atri (57197756994); Guo, Jianmei (55550120500); Siegmund, Norbert (25825645900); Apel, Sven (8725218400); Czarnecki, Krzysztof (6603948729)","57197756994; 55550120500; 25825645900; 8725218400; 6603948729","Cost-efficient sampling for performance prediction of configurable systems","2016","Proceedings - 2015 30th IEEE/ACM International Conference on Automated Software Engineering, ASE 2015","","","7372023","342","352","10","122","10.1109/ASE.2015.45","https://www.scopus.com/inward/record.uri?eid=2-s2.0-84963815450&doi=10.1109%2fASE.2015.45&partnerID=40&md5=71ca63c6251026190356682a97c06917","Conference paper","Final","","Scopus","2-s2.0-84963815450"
"Qi L.; Jiang Y.; Li Z.; Ma X.; Zheng Z.; Wang W.","Qi, Long (35436115500); Jiang, Yu (56746688100); Li, Zehua (55756600900); Ma, Xu (7404549174); Zheng, Zhixiong (55823082700); Wang, Wenjuan (55827533100)","35436115500; 56746688100; 55756600900; 7404549174; 55823082700; 55827533100","Automatic detection and counting method for spores of rice blast based on micro image processing","2015","Nongye Gongcheng Xuebao/Transactions of the Chinese Society of Agricultural Engineering","31","12","","186","193","7","35","10.11975/j.issn.1002-6819.2015.12.025","https://www.scopus.com/inward/record.uri?eid=2-s2.0-84938370375&doi=10.11975%2fj.issn.1002-6819.2015.12.025&partnerID=40&md5=158387b0214266a0661c69ac4e68be3e","Article","Final","","Scopus","2-s2.0-84938370375"
"Siegmund N.; Grebhahn A.; Apel S.; Kästner C.","Siegmund, Norbert (25825645900); Grebhahn, Alexander (42161301000); Apel, Sven (8725218400); Kästner, Christian (35547901100)","25825645900; 42161301000; 8725218400; 35547901100","Performance-influence models for highly configurable systems","2015","2015 10th Joint Meeting of the European Software Engineering Conference and the ACM SIGSOFT Symposium on the Foundations of Software Engineering, ESEC/FSE 2015 - Proceedings","","","","284","294","10","202","10.1145/2786805.2786845","https://www.scopus.com/inward/record.uri?eid=2-s2.0-84960388769&doi=10.1145%2f2786805.2786845&partnerID=40&md5=ae7f072168fadcd086bc525ea86f6d51","Conference paper","Final","All Open Access; Green Open Access","Scopus","2-s2.0-84960388769"
"Kolesnikov S.; Siegmund N.; Kästner C.; Grebhahn A.; Apel S.","Kolesnikov, Sergiy (36451024500); Siegmund, Norbert (25825645900); Kästner, Christian (35547901100); Grebhahn, Alexander (42161301000); Apel, Sven (8725218400)","36451024500; 25825645900; 35547901100; 42161301000; 8725218400","Tradeoffs in modeling performance of highly configurable software systems","2019","Software and Systems Modeling","18","3","","2265","2283","18","37","10.1007/s10270-018-0662-9","https://www.scopus.com/inward/record.uri?eid=2-s2.0-85041547498&doi=10.1007%2fs10270-018-0662-9&partnerID=40&md5=013a67ff11f375a216678f6cd182cfd5","Article","Final","","Scopus","2-s2.0-85041547498"
"Grebhahn A.; Rodrigo C.; Siegmund N.; Gaspar F.J.; Apel S.","Grebhahn, Alexander (42161301000); Rodrigo, Carmen (25028647200); Siegmund, Norbert (25825645900); Gaspar, Francisco J. (6604020629); Apel, Sven (8725218400)","42161301000; 25028647200; 25825645900; 6604020629; 8725218400","Performance-influence models of multigrid methods: A case study on triangular grids","2017","Concurrency and Computation: Practice and Experience","29","17","e4057","","","","16","10.1002/cpe.4057","https://www.scopus.com/inward/record.uri?eid=2-s2.0-85011324301&doi=10.1002%2fcpe.4057&partnerID=40&md5=10d0286c45d08574b3bfc7036bf025a6","Conference paper","Final","","Scopus","2-s2.0-85011324301"
