"Authors","Author full names","Author(s) ID","Title","Year","Source title","Volume","Issue","Art. No.","Page start","Page end","Page count","Cited by","DOI","Link","Document Type","Publication Stage","Open Access","Source","EID"
"Ren J.; Li J.; Meng X.","Ren, Jianhua (55570793500); Li, Jing (59080841100); Meng, Xiangfu (57208540297)","55570793500; 59080841100; 57208540297","Document Classification Method Based on Context Awareness and Hierarchical Attention Network; [上下文感知与层级注意力网络的文档分类方法]","2021","Journal of Frontiers of Computer Science and Technology","15","2","","305","314","9","2","10.3778/j.issn.1673-9418.1912048","https://www.scopus.com/inward/record.uri?eid=2-s2.0-85113797026&doi=10.3778%2fj.issn.1673-9418.1912048&partnerID=40&md5=4833e5eaeebf60d5681c45112988a4cc","Article","Final","","Scopus","2-s2.0-85113797026"
"Sheu J.-S.; Wu S.-R.; Wu W.-H.","Sheu, Jeng-Shin (54963790900); Wu, Siang-Ru (58128251800); Wu, Wen-Hung (58127704700)","54963790900; 58128251800; 58127704700","Performance Improvement on Traditional Chinese Task-Oriented Dialogue Systems With Reinforcement Learning and Regularized Dropout Technique","2023","IEEE Access","11","","","19849","19862","13","5","10.1109/ACCESS.2023.3248796","https://www.scopus.com/inward/record.uri?eid=2-s2.0-85149385447&doi=10.1109%2fACCESS.2023.3248796&partnerID=40&md5=0f398f7202a2989278701d2df5850134","Article","Final","All Open Access; Gold Open Access","Scopus","2-s2.0-85149385447"
"Chen Z.; Liu C.","Chen, Zhonghao (57388822400); Liu, Cong (35208633300)","57388822400; 35208633300","An Attention Method to Introduce Prior Knowledge in Dialogue State Tracking","2021","Lecture Notes in Computer Science (including subseries Lecture Notes in Artificial Intelligence and Lecture Notes in Bioinformatics)","13110 LNCS","","","544","557","13","0","10.1007/978-3-030-92238-2_45","https://www.scopus.com/inward/record.uri?eid=2-s2.0-85121925003&doi=10.1007%2f978-3-030-92238-2_45&partnerID=40&md5=4ee487aa2210024c851031610b6635f7","Conference paper","Final","","Scopus","2-s2.0-85121925003"
"Ji T.; Yin X.; Cheng P.; Zhou L.; Liu S.; Bao W.; Lyu C.","Ji, Tianbo (57204391153); Yin, Xuanhua (57999564400); Cheng, Peng (57661547200); Zhou, Liting (56595378300); Liu, Siyou (57190124446); Bao, Wei (56428494300); Lyu, Chenyang (57220488337)","57204391153; 57999564400; 57661547200; 56595378300; 57190124446; 56428494300; 57220488337","IvCDS: An End-to-End Driver Simulator for Personal In-Vehicle Conversational Assistant","2022","International Journal of Environmental Research and Public Health","19","23","15493","","","","0","10.3390/ijerph192315493","https://www.scopus.com/inward/record.uri?eid=2-s2.0-85143710121&doi=10.3390%2fijerph192315493&partnerID=40&md5=c4130505ffb86761cf718e768923a421","Article","Final","All Open Access; Gold Open Access; Green Open Access","Scopus","2-s2.0-85143710121"
"Li X.; Song K.; Feng S.; Wang D.; Zhang Y.","Li, Xiangju (56819139400); Song, Kaisong (55131158400); Feng, Shi (36173786700); Wang, Dating (8543200700); Zhang, Yifei (36618421200)","56819139400; 55131158400; 36173786700; 8543200700; 36618421200","A co-attention neural network model for emotion cause analysis with emotional context awareness","2018","Proceedings of the 2018 Conference on Empirical Methods in Natural Language Processing, EMNLP 2018","","","","4752","4757","5","115","","https://www.scopus.com/inward/record.uri?eid=2-s2.0-85072965695&partnerID=40&md5=edfd1988e67ff9b11169bc5806acaeca","Conference paper","Final","","Scopus","2-s2.0-85072965695"
"Elder H.; Gehrmann S.; O’Connor A.; Liu Q.","Elder, Henry (57217384385); Gehrmann, Sebastian (57055812200); O’Connor, Alexander (59427353100); Liu, Qun (56181387900)","57217384385; 57055812200; 59427353100; 56181387900","E2E NLG challenge submission: Towards controllable generation of diverse natural language","2018","INLG 2018 - 11th International Natural Language Generation Conference, Proceedings of the Conference","","","","457","462","5","12","","https://www.scopus.com/inward/record.uri?eid=2-s2.0-85070110909&partnerID=40&md5=1913f951543781e36facad75f8d43a12","Conference paper","Final","","Scopus","2-s2.0-85070110909"
"Chauhan R.; Shukla S.; Pokhriyal S.; Devliyal S.; Kumar R.R.","Chauhan, Rahul (57220045108); Shukla, Siddharth (59353004000); Pokhriyal, Siddharth (57462656400); Devliyal, Swati (55445459800); Kumar, Ravi Ranjan (57214462060)","57220045108; 59353004000; 57462656400; 55445459800; 57214462060","Enhancement of Usability of AI Chatbots using Machine Learning","2024","2024 Asia Pacific Conference on Innovation in Technology, APCIT 2024","","","","","","","0","10.1109/APCIT62007.2024.10673475","https://www.scopus.com/inward/record.uri?eid=2-s2.0-85205548847&doi=10.1109%2fAPCIT62007.2024.10673475&partnerID=40&md5=1f46a85de63f12d9e466cd2939f752cf","Conference paper","Final","","Scopus","2-s2.0-85205548847"
"Carvalho I.; Oliveira H.G.; Silva C.","Carvalho, Isabel (57215935619); Oliveira, Hugo Goncalo (25031534700); Silva, Catarina (8770080300)","57215935619; 25031534700; 8770080300","The Importance of Context for Sentiment Analysis in Dialogues","2023","IEEE Access","11","","","86088","86103","15","5","10.1109/ACCESS.2023.3304633","https://www.scopus.com/inward/record.uri?eid=2-s2.0-85168258567&doi=10.1109%2fACCESS.2023.3304633&partnerID=40&md5=67cd701910c68f2d6c8a38050d1906e5","Article","Final","All Open Access; Gold Open Access; Green Open Access","Scopus","2-s2.0-85168258567"
"Yan Y.; Kang Y.; Huang W.; Cai X.","Yan, Yang (55903247900); Kang, Yufeng (59348645400); Huang, Wenbo (55903037200); Cai, Xudong (59658205200)","55903247900; 59348645400; 55903037200; 59658205200","Chinese medical named entity recognition utilizing entity association and gate context awareness","2025","PLoS ONE","20","2 February","e0319056","","","","0","10.1371/journal.pone.0319056","https://www.scopus.com/inward/record.uri?eid=2-s2.0-85219012905&doi=10.1371%2fjournal.pone.0319056&partnerID=40&md5=8e5196ccf88c4bcd21313a1d7c9091ed","Article","Final","All Open Access; Gold Open Access","Scopus","2-s2.0-85219012905"
"Mudigonda K.S.P.; Bulusu K.; Sri Y.; Damera A.; Kode V.","Mudigonda, Krishna Siva Prasad (57204723760); Bulusu, Karthik (59386038900); Sri, Yashmitha (59385315100); Damera, Adithi (59385531600); Kode, Vignesh (59385315200)","57204723760; 59386038900; 59385315100; 59385531600; 59385315200","Capturing multiple emotions from conversational data using fine tuned transformers","2024","International Journal of Computers and Applications","46","12","","1166","1178","12","0","10.1080/1206212X.2024.2420189","https://www.scopus.com/inward/record.uri?eid=2-s2.0-85207523360&doi=10.1080%2f1206212X.2024.2420189&partnerID=40&md5=5c242c3c743251ad6e16583c1dd1ea3e","Article","Final","","Scopus","2-s2.0-85207523360"
"Wang D.; Chen Z.; He W.; Zhong L.; Tao Y.; Yang M.","Wang, Dingmin (57222286041); Chen, Ziyao (57225065948); He, Wanwei (57221048519); Zhong, Li (57225066345); Tao, Yunzhe (59275576900); Yang, Min (56349712700)","57222286041; 57225065948; 57221048519; 57225066345; 59275576900; 56349712700","A Template-guided Hybrid Pointer Network for Knowledge-based Task-oriented Dialogue Systems","2021","DialDoc 2021 - 1st Workshop on Document-Grounded Dialogue and Conversational Question Answering, Proceedings","","","","18","28","10","8","","https://www.scopus.com/inward/record.uri?eid=2-s2.0-85123306623&partnerID=40&md5=bd885c89a207872281b74c0f8f8265d2","Conference paper","Final","","Scopus","2-s2.0-85123306623"
"Sonie O.; Chakraborty A.; Mullick A.","Sonie, Omprakash (57204706428); Chakraborty, Abir (57462192900); Mullick, Ankan (57200217431)","57204706428; 57462192900; 57200217431","concept2code: Deep Reinforcement Learning for Conversational AI","2022","Proceedings of the ACM SIGKDD International Conference on Knowledge Discovery and Data Mining","","","","4826","4827","1","0","10.1145/3534678.3542635","https://www.scopus.com/inward/record.uri?eid=2-s2.0-85137140693&doi=10.1145%2f3534678.3542635&partnerID=40&md5=e89cc10f416d8802f0e873be583e6be9","Conference paper","Final","","Scopus","2-s2.0-85137140693"
"Shen T.; Wang X.","Shen, Tianhao (57651325700); Wang, Xiaojie (35235644100)","57651325700; 35235644100","Multi-Domain Dialogue State Tracking with Hierarchical Task Graph","2020","Proceedings of the International Joint Conference on Neural Networks","","","9206790","","","","2","10.1109/IJCNN48605.2020.9206790","https://www.scopus.com/inward/record.uri?eid=2-s2.0-85093835657&doi=10.1109%2fIJCNN48605.2020.9206790&partnerID=40&md5=f9cd86f38942e05943c7a4d49390a387","Conference paper","Final","","Scopus","2-s2.0-85093835657"
"Fernández-González D.","Fernández-González, Daniel (55358318900)","55358318900","Shift-Reduce Task-Oriented Semantic Parsing with Stack-Transformers","2024","Cognitive Computation","16","6","","2846","2862","16","0","10.1007/s12559-024-10339-4","https://www.scopus.com/inward/record.uri?eid=2-s2.0-85201793778&doi=10.1007%2fs12559-024-10339-4&partnerID=40&md5=dcf31e0b2b74caa6ae7b6cb58f6c20fc","Article","Final","All Open Access; Hybrid Gold Open Access","Scopus","2-s2.0-85201793778"
"Lakkshmanan A.; Amudhan S.; Gaikwad S.M.; Tyagi A.K.","Lakkshmanan, Ajanthaa (56041905600); Amudhan, S. (59232933100); Gaikwad, Smita M. (58977112500); Tyagi, Amit Kumar (58100922500)","56041905600; 59232933100; 58977112500; 58100922500","Further research opportunities and challenges towards AI-driven tools for modern generation","2024","Impacts of Generative AI on Creativity in Higher Education","","","","69","100","31","0","10.4018/979-8-3693-2418-9.ch004","https://www.scopus.com/inward/record.uri?eid=2-s2.0-85207580522&doi=10.4018%2f979-8-3693-2418-9.ch004&partnerID=40&md5=ce753cc3bccaaf36edb5262d517a389a","Book chapter","Final","","Scopus","2-s2.0-85207580522"
"Liu Q.; Cheng G.; Gunaratna K.; Qu Y.","Liu, Qingxia (57007322500); Cheng, Gong (36103954800); Gunaratna, Kalpa (57151152400); Qu, Yuzhong (8400208900)","57007322500; 36103954800; 57151152400; 8400208900","Entity summarization: State of the art and future challenges","2021","Journal of Web Semantics","69","","100647","","","","25","10.1016/j.websem.2021.100647","https://www.scopus.com/inward/record.uri?eid=2-s2.0-85107659423&doi=10.1016%2fj.websem.2021.100647&partnerID=40&md5=5db182d663b29b9e8398dab4c475f3a9","Short survey","Final","All Open Access; Green Open Access","Scopus","2-s2.0-85107659423"
"Qiu S.; Zhang K.","Qiu, Shuang (57226268411); Zhang, Kang (57360408800)","57226268411; 57360408800","Learning Personalized End-to-End Task-Oriented Dialogue for Fast and Reliable Adaptation","2021","2021 International Conference on Digital Society and Intelligent Systems, DSInS 2021","","","","62","66","4","2","10.1109/DSInS54396.2021.9670559","https://www.scopus.com/inward/record.uri?eid=2-s2.0-85125106354&doi=10.1109%2fDSInS54396.2021.9670559&partnerID=40&md5=c732e8d81a857dba1bb54ac77d4b92b7","Conference paper","Final","","Scopus","2-s2.0-85125106354"
"Wang L.; Zhao Y.; Wang J.","Wang, Lubao (57932369300); Zhao, Yifan (57932230000); Wang, Junhua (55742774200)","57932369300; 57932230000; 55742774200","An end-to-end information fusion model for task-oriented dialogue systems","2022","ACM International Conference Proceeding Series","","","","155","158","3","0","10.1145/3562007.3562035","https://www.scopus.com/inward/record.uri?eid=2-s2.0-85140067762&doi=10.1145%2f3562007.3562035&partnerID=40&md5=9ed69fdcbc8a7f63bde83a5547dd79ef","Conference paper","Final","","Scopus","2-s2.0-85140067762"
"Guimarães M.; Carneiro D.; Soares L.; Ribeiro M.; Loureiro G.","Guimarães, Miguel (57219162006); Carneiro, Davide (24723727400); Soares, Lucas (59704803800); Ribeiro, Miguel (59705517600); Loureiro, Gilberto (59704438500)","57219162006; 24723727400; 59704803800; 59705517600; 59704438500","A Human-Centric Architecture for Natural Interaction with Organizational Systems","2025","Lecture Notes in Networks and Systems","1283 LNNS","","","60","78","18","0","10.1007/978-3-031-84457-7_4","https://www.scopus.com/inward/record.uri?eid=2-s2.0-105000808921&doi=10.1007%2f978-3-031-84457-7_4&partnerID=40&md5=d0e0172c14fe64f1e69aa83d8b0d538d","Conference paper","Final","","Scopus","2-s2.0-105000808921"
"Juraska J.; Bowden K.K.; Walker M.","Juraska, Juraj (57212084055); Bowden, Kevin K. (57192085897); Walker, Marilyn (55461478300)","57212084055; 57192085897; 55461478300","ViGGO: A video game corpus for data-to-text generation in open-domain conversation","2019","INLG 2019 - 12th International Conference on Natural Language Generation, Proceedings of the Conference","","","","164","172","8","19","","https://www.scopus.com/inward/record.uri?eid=2-s2.0-85087180018&partnerID=40&md5=1a6b2722dafa5d72afe370c18fbdbb01","Conference paper","Final","","Scopus","2-s2.0-85087180018"
"Paul A.; Latif A.H.; Adnan F.A.; Rahman R.M.","Paul, Anirudha (57196011398); Latif, Asiful Haque (57196004582); Adnan, Foysal Amin (57196005409); Rahman, Rashedur M. (57202814494)","57196011398; 57196004582; 57196005409; 57202814494","Focused domain contextual ai chatbot framework for resource poor languages","2019","Journal of Information and Telecommunication","3","2","","248","269","21","20","10.1080/24751839.2018.1558378","https://www.scopus.com/inward/record.uri?eid=2-s2.0-85080560942&doi=10.1080%2f24751839.2018.1558378&partnerID=40&md5=5b7743dfe7ec5466d6267d975f112484","Article","Final","All Open Access; Gold Open Access","Scopus","2-s2.0-85080560942"
"Li S.; Zhu H.; Wu W.; Shen X.S.","Li, Shaofeng (57212252504); Zhu, Haojin (19640836400); Wu, Wen (57195476680); Shen, Xuemin Sherman (58930166400)","57212252504; 19640836400; 57195476680; 58930166400","Backdoor Attacks against Learning-Based Algorithms","2024","Wireless Networks (United Kingdom)","Part F2916","","","1","153","152","0","10.1007/978-3-031-57389-7","https://www.scopus.com/inward/record.uri?eid=2-s2.0-85213973923&doi=10.1007%2f978-3-031-57389-7&partnerID=40&md5=a91e501b0311079e54699b1a865b6ab1","Book chapter","Final","","Scopus","2-s2.0-85213973923"
"Agrawal A.; Shukla P.","Agrawal, Arpit (58237051400); Shukla, Pragya (57210538654)","58237051400; 57210538654","Context Aware Automatic Subjective and Objective Question Generation using Fast Text to Text Transfer Learning","2023","International Journal of Advanced Computer Science and Applications","14","4","","456","463","7","3","10.14569/IJACSA.2023.0140451","https://www.scopus.com/inward/record.uri?eid=2-s2.0-85158115785&doi=10.14569%2fIJACSA.2023.0140451&partnerID=40&md5=8b3782def089966c52bf9c193d747499","Article","Final","All Open Access; Gold Open Access","Scopus","2-s2.0-85158115785"
"Alhussayni K.H.; Alshamery E.S.","Alhussayni, Khaldoon H. (57211978478); Alshamery, Eman S. (57193058309)","57211978478; 57193058309","Automated COVID-19 dialogue system using a new deep learning network","2021","Periodicals of Engineering and Natural Sciences","9","2","","667","677","10","5","10.21533/pen.v9i2.1862","https://www.scopus.com/inward/record.uri?eid=2-s2.0-85108583174&doi=10.21533%2fpen.v9i2.1862&partnerID=40&md5=58394c295f082fd02073287446676c7c","Article","Final","All Open Access; Gold Open Access","Scopus","2-s2.0-85108583174"
"Robloke R.; Kijsirikul B.","Robloke, Ramon (57214221021); Kijsirikul, Boonserm (6603602953)","57214221021; 6603602953","A task-oriented dialogue bot using long short-term memory with attention for Thai language","2019","ACM International Conference Proceeding Series","","","","","","","0","10.1145/3373477.3373704","https://www.scopus.com/inward/record.uri?eid=2-s2.0-85123043149&doi=10.1145%2f3373477.3373704&partnerID=40&md5=0b8d1f26b092b17c1314c86334fe48a7","Conference paper","Final","","Scopus","2-s2.0-85123043149"
"Malaviya P.; Patel D.; Bharti S.","Malaviya, Priyanshu (58919130700); Patel, Dhruvit (59134387300); Bharti, Santosh (57188719252)","58919130700; 59134387300; 57188719252","Video Captioning Using Large Language Models","2024","2024 3rd International Conference for Innovation in Technology, INOCON 2024","","","","","","","2","10.1109/INOCON60754.2024.10512233","https://www.scopus.com/inward/record.uri?eid=2-s2.0-85193622691&doi=10.1109%2fINOCON60754.2024.10512233&partnerID=40&md5=288f80224a18fc7340cf660f4effbcd7","Conference paper","Final","","Scopus","2-s2.0-85193622691"
"Sharma S.; He J.; Suleman K.; Schulz H.; Bachman P.","Sharma, Shikhar (57213924183); He, Jing (58259340800); Suleman, Kaheer (57213294570); Schulz, Hannes (57216614371); Bachman, Philip (35168417700)","57213924183; 58259340800; 57213294570; 57216614371; 35168417700","NATURAL LANGUAGE GENERATION IN DIALOGUE USING LEXICALIZED AND DELEXICALIZED DATA","2017","5th International Conference on Learning Representations, ICLR 2017 - Workshop Track Proceedings","","","","","","","10","","https://www.scopus.com/inward/record.uri?eid=2-s2.0-85087165071&partnerID=40&md5=0e6d9299e6790eaeb49a680b873652ba","Conference paper","Final","","Scopus","2-s2.0-85087165071"
"Liu W.; Xin T.","Liu, Wei (56670857100); Xin, Tong (57331022700)","56670857100; 57331022700","EntroMAGNN: An Entropy-Driven Metapath-Based Graph Neural Network for Maritime Emergency Event Prediction","2024","Lecture Notes in Computer Science (including subseries Lecture Notes in Artificial Intelligence and Lecture Notes in Bioinformatics)","14874 LNCS","","","170","186","16","0","10.1007/978-981-97-5618-6_15","https://www.scopus.com/inward/record.uri?eid=2-s2.0-85201072163&doi=10.1007%2f978-981-97-5618-6_15&partnerID=40&md5=8a6287bc988b994173ce104a2a6c9b21","Conference paper","Final","","Scopus","2-s2.0-85201072163"
"Barker M.","Barker, Michael (58541775400)","58541775400","Context Awareness and Deep Learning Algorithms, Immersive Visualization and Autonomous Cognitive Systems, and Natural Language Processing and Digital Twin Modeling Tools in the Blockchain-based Metaverse","2023","Review of Contemporary Philosophy","22","","","102","118","16","0","10.22381/RCP2220236","https://www.scopus.com/inward/record.uri?eid=2-s2.0-85172659600&doi=10.22381%2fRCP2220236&partnerID=40&md5=6f9cbb1cf83a46f752f23eac6f567a01","Article","Final","","Scopus","2-s2.0-85172659600"
"Mehrjardi M.S.; Trablesi A.; Zaïane O.R.","Mehrjardi, Mansour Saffar (57212345239); Trablesi, Amine (44861809800); Zaïane, Osmar R. (6602849837)","57212345239; 44861809800; 6602849837","Self-attentional models application in task-oriented dialogue generation systems","2019","International Conference Recent Advances in Natural Language Processing, RANLP","2019-September","","","1031","1040","9","2","","https://www.scopus.com/inward/record.uri?eid=2-s2.0-85076481968&partnerID=40&md5=d70d87a8b6a6a09dba42b39f755038a9","Conference paper","Final","","Scopus","2-s2.0-85076481968"
"Borhanifard Z.; Basafa H.; Razavi S.Z.; Faili H.","Borhanifard, Zeinab (57195148229); Basafa, Hossein (57222099132); Razavi, Seyedeh Zahra (57191888059); Faili, Heshaam (27367722500)","57195148229; 57222099132; 57191888059; 27367722500","Persian language understanding in task-oriented dialogue system for online shopping","2020","2020 11th International Conference on Information and Knowledge Technology, IKT 2020","","","9345639","79","84","5","2","10.1109/IKT51791.2020.9345639","https://www.scopus.com/inward/record.uri?eid=2-s2.0-85101394037&doi=10.1109%2fIKT51791.2020.9345639&partnerID=40&md5=f7d47a694be86e5f883572fd0527f8e7","Conference paper","Final","","Scopus","2-s2.0-85101394037"
"Qin L.; Chen Q.; Xu X.; Feng Y.; Che W.","Qin, Libo (57204392284); Chen, Qiguang (57289894300); Xu, Xiao (57219737363); Feng, Yunlong (57221148852); Che, Wanxiang (57204332760)","57204392284; 57289894300; 57219737363; 57221148852; 57204332760","OpenSLU: A unified, modularized, and extensible toolkit for spoken language understanding","2023","Proceedings of the Annual Meeting of the Association for Computational Linguistics","3","","","95","102","7","1","10.18653/v1/2023.acl-demo.9","https://www.scopus.com/inward/record.uri?eid=2-s2.0-85173530124&doi=10.18653%2fv1%2f2023.acl-demo.9&partnerID=40&md5=69145e416ab9b2ce4ed338eb10e2a6ea","Conference paper","Final","All Open Access; Green Open Access; Hybrid Gold Open Access","Scopus","2-s2.0-85173530124"
"Chen M.; Lin Z.; Sun R.; Ouyang K.; Zheng H.-T.; Xie R.; Wu W.","Chen, Miaoxin (57387303200); Lin, Zibo (57216692642); Sun, Rongyi (57323655800); Ouyang, Kai (57668389500); Zheng, Hai-Tao (57203433967); Xie, Rui (57220790933); Wu, Wei (57192664206)","57387303200; 57216692642; 57323655800; 57668389500; 57203433967; 57220790933; 57192664206","RETRIEVAL ENHANCED SEGMENT GENERATION NEURAL NETWORK FOR TASK-ORIENTED DIALOGUE SYSTEMS","2022","ICASSP, IEEE International Conference on Acoustics, Speech and Signal Processing - Proceedings","2022-May","","","6592","6596","4","2","10.1109/ICASSP43922.2022.9747600","https://www.scopus.com/inward/record.uri?eid=2-s2.0-85131260731&doi=10.1109%2fICASSP43922.2022.9747600&partnerID=40&md5=d25f61572f4671d09dfc3ff6fe9d1837","Conference paper","Final","","Scopus","2-s2.0-85131260731"
"Sun H.; Zhao C.; Liu S.; Jiang H.","Sun, HaoYuan (58257836700); Zhao, ChunYi (57869199800); Liu, ShiQiang (58605101800); Jiang, HuanHuan (58407906900)","58257836700; 57869199800; 58605101800; 58407906900","A Pipeline Dialogue System Scheme","2021","ICMLCA 2021 - 2nd International Conference on Machine Learning and Computer Application","","","","58","62","4","0","","https://www.scopus.com/inward/record.uri?eid=2-s2.0-85137049062&partnerID=40&md5=aff5d6beb613bf1207f7e5e70de1cf4e","Conference paper","Final","","Scopus","2-s2.0-85137049062"
"Liu M.; Sui M.; Nian Y.; Wang C.; Zhou Z.","Liu, Minghao (57192654820); Sui, Mingxiu (59243137100); Nian, Yi (57275114800); Wang, Cangqing (59640392000); Zhou, Zhijie (59408946900)","57192654820; 59243137100; 57275114800; 59640392000; 59408946900","CA-BERT: Leveraging Context Awareness for Enhanced Multi-Turn Chat Interaction","2024","2024 5th International Conference on Big Data and Artificial Intelligence and Software Engineering, ICBASE 2024","","","","388","392","4","0","10.1109/ICBASE63199.2024.10762240","https://www.scopus.com/inward/record.uri?eid=2-s2.0-85213817156&doi=10.1109%2fICBASE63199.2024.10762240&partnerID=40&md5=40f39308ee5be81ea4532af58f6e3ee2","Conference paper","Final","All Open Access; Green Open Access","Scopus","2-s2.0-85213817156"
"Xu K.; Wang Z.-Y.; Wang X.; Qin H.; Long Y.-X.","Xu, Kai (57222480317); Wang, Zhen-Yu (54586133800); Wang, Xu (59186889000); Qin, Hua (57614726400); Long, Yu-Xuan (59171964000)","57222480317; 54586133800; 59186889000; 57614726400; 59171964000","A Survey of Task-Oriented Dialogue Policies Based on Reinforcement Learning; [基于强化学习的任务型对话策略研究综述]","2024","Jisuanji Xuebao/Chinese Journal of Computers","47","6","","1201","1231","30","0","10.11897/SP.J.1016.2024.01201","https://www.scopus.com/inward/record.uri?eid=2-s2.0-85196786959&doi=10.11897%2fSP.J.1016.2024.01201&partnerID=40&md5=6a5e87f4d413a9b0e626262389e9706c","Article","Final","","Scopus","2-s2.0-85196786959"
"Nayak N.; Hakkani-Tör D.; Walker M.; Heck L.","Nayak, Neha (57200083754); Hakkani-Tör, Dilek (59528332600); Walker, Marilyn (55461478300); Heck, Larry (7005241213)","57200083754; 59528332600; 55461478300; 7005241213","To Plan or not to Plan? Discourse planning in slot-value informed sequence to sequence models for language generation","2017","Proceedings of the Annual Conference of the International Speech Communication Association, INTERSPEECH","2017-August","","","3339","3343","4","33","10.21437/Interspeech.2017-1525","https://www.scopus.com/inward/record.uri?eid=2-s2.0-85039158378&doi=10.21437%2fInterspeech.2017-1525&partnerID=40&md5=fb68d220efa033f3ecde6d99adc8e74e","Conference paper","Final","","Scopus","2-s2.0-85039158378"
"Qi Z.","Qi, Zhenzhen (58904460600)","58904460600","English Sentence Semantic Feature Extraction Method Based on Fuzzy Logic Algorithm","2024","Journal of Electrical Systems","20","1","","262","275","13","2","10.52783/jes.681","https://www.scopus.com/inward/record.uri?eid=2-s2.0-85185889633&doi=10.52783%2fjes.681&partnerID=40&md5=05b51d9974ec9bd1bb7f6a982a5b0c41","Article","Final","All Open Access; Hybrid Gold Open Access","Scopus","2-s2.0-85185889633"
"Li Y.; Yao K.; Qin L.; Che W.; Li X.; Liu T.","Li, Yangming (57216693544); Yao, Kaisheng (7403234535); Qin, Libo (57204392284); Che, Wangxiang (57204332760); Li, Xiaolong (57195598289); Liu, Ting (57199476645)","57216693544; 7403234535; 57204392284; 57204332760; 57195598289; 57199476645","Slot-consistent NLG for task-oriented dialogue systems with iterative rectification network","2020","Proceedings of the Annual Meeting of the Association for Computational Linguistics","","","","97","106","9","18","","https://www.scopus.com/inward/record.uri?eid=2-s2.0-85116698040&partnerID=40&md5=e2a0bd469688d1ffaf25a3c50c23353b","Conference paper","Final","","Scopus","2-s2.0-85116698040"
"","","","17th China National Conference on Computational Linguistics, CCL 2018 and 6th International Symposium on Natural Language Processing Based on Naturally Annotated Big Data, NLP-NABD 2018","2018","Lecture Notes in Computer Science (including subseries Lecture Notes in Artificial Intelligence and Lecture Notes in Bioinformatics)","11221 LNAI","","","","","409","0","","https://www.scopus.com/inward/record.uri?eid=2-s2.0-85055448190&partnerID=40&md5=f994279f21eaabbb44ff7af82afd31b6","Conference review","Final","","Scopus","2-s2.0-85055448190"
